,movie_name,rating,qualifiers,release_year,protagonist_dir,IMDB_link,Summary
168,Warrior,8.105903753708223,462156,(2011),"Gavin O'Connor (dir.), Tom Hardy, Nick Nolte",https://www.imdb.com/title/tt1291584/?pf_rd_m=A2FGELUUNOQJNL&pf_rd_p=1a264172-ae11-42e4-8ef7-7fed1973bb8f&pf_rd_r=MBY5AS7XQMWKBXS6Y8N7&pf_rd_s=center-1&pf_rd_t=15506&pf_rd_i=top&ref_=chttp_tt_169,"The youngest son of an alcoholic former boxer returns home, where he's trained by his father for competition in a mixed martial arts tournament - a path that puts the fighter on a collision ... Read allThe youngest son of an alcoholic former boxer returns home, where he's trained by his father for competition in a mixed martial arts tournament - a path that puts the fighter on a collision course with his estranged, older brother.The youngest son of an alcoholic former boxer returns home, where he's trained by his father for competition in a mixed martial arts tournament - a path that puts the fighter on a collision course with his estranged, older brother."
169,Fargo,8.103545813075444,662102,(1996),"Joel Coen (dir.), William H. Macy, Frances McDormand",https://www.imdb.com/title/tt0116282/?pf_rd_m=A2FGELUUNOQJNL&pf_rd_p=1a264172-ae11-42e4-8ef7-7fed1973bb8f&pf_rd_r=MBY5AS7XQMWKBXS6Y8N7&pf_rd_s=center-1&pf_rd_t=15506&pf_rd_i=top&ref_=chttp_tt_170,Minnesota car salesman Jerry Lundegaard's inept crime falls apart due to his and his henchmen's bungling and the persistent police work of the quite pregnant Marge Gunderson.Minnesota car salesman Jerry Lundegaard's inept crime falls apart due to his and his henchmen's bungling and the persistent police work of the quite pregnant Marge Gunderson.Minnesota car salesman Jerry Lundegaard's inept crime falls apart due to his and his henchmen's bungling and the persistent police work of the quite pregnant Marge Gunderson.
170,Mi vecino Totoro,8.095961608007086,325852,(1988),"Hayao Miyazaki (dir.), Hitoshi Takagi, Noriko Hidaka",https://www.imdb.com/title/tt0096283/?pf_rd_m=A2FGELUUNOQJNL&pf_rd_p=1a264172-ae11-42e4-8ef7-7fed1973bb8f&pf_rd_r=MBY5AS7XQMWKBXS6Y8N7&pf_rd_s=center-1&pf_rd_t=15506&pf_rd_i=top&ref_=chttp_tt_171,"When two girls move to the country to be near their ailing mother, they have adventures with the wondrous forest spirits who live nearby.When two girls move to the country to be near their ailing mother, they have adventures with the wondrous forest spirits who live nearby.When two girls move to the country to be near their ailing mother, they have adventures with the wondrous forest spirits who live nearby."
171,Intriga,8.092606560356769,675866,(2013),"Denis Villeneuve (dir.), Hugh Jackman, Jake Gyllenhaal",https://www.imdb.com/title/tt1392214/?pf_rd_m=A2FGELUUNOQJNL&pf_rd_p=1a264172-ae11-42e4-8ef7-7fed1973bb8f&pf_rd_r=MBY5AS7XQMWKBXS6Y8N7&pf_rd_s=center-1&pf_rd_t=15506&pf_rd_i=top&ref_=chttp_tt_172,"When Keller Dover's daughter and her friend go missing, he takes matters into his own hands as the police pursue multiple leads and the pressure mounts.When Keller Dover's daughter and her friend go missing, he takes matters into his own hands as the police pursue multiple leads and the pressure mounts.When Keller Dover's daughter and her friend go missing, he takes matters into his own hands as the police pursue multiple leads and the pressure mounts."
172,Million Dollar Baby,8.090428229619032,673676,(2004),"Clint Eastwood (dir.), Hilary Swank, Clint Eastwood",https://www.imdb.com/title/tt0405159/?pf_rd_m=A2FGELUUNOQJNL&pf_rd_p=1a264172-ae11-42e4-8ef7-7fed1973bb8f&pf_rd_r=MBY5AS7XQMWKBXS6Y8N7&pf_rd_s=center-1&pf_rd_t=15506&pf_rd_i=top&ref_=chttp_tt_173,A determined woman works with a hardened boxing trainer to become a professional.A determined woman works with a hardened boxing trainer to become a professional.A determined woman works with a hardened boxing trainer to become a professional.
173,The Gold Rush,8.08815280381621,109424,(1925),"Charles Chaplin (dir.), Charles Chaplin, Mack Swain",https://www.imdb.com/title/tt0015864/?pf_rd_m=A2FGELUUNOQJNL&pf_rd_p=1a264172-ae11-42e4-8ef7-7fed1973bb8f&pf_rd_r=MBY5AS7XQMWKBXS6Y8N7&pf_rd_s=center-1&pf_rd_t=15506&pf_rd_i=top&ref_=chttp_tt_174,"A prospector goes to the Klondike during the 1890s gold rush in hopes of making his fortune, and is smitten with a girl he sees in a dance hall.A prospector goes to the Klondike during the 1890s gold rush in hopes of making his fortune, and is smitten with a girl he sees in a dance hall.A prospector goes to the Klondike during the 1890s gold rush in hopes of making his fortune, and is smitten with a girl he sees in a dance hall."
174,Blade Runner,8.087402481604737,746363,(1982),"Ridley Scott (dir.), Harrison Ford, Rutger Hauer",https://www.imdb.com/title/tt0083658/?pf_rd_m=A2FGELUUNOQJNL&pf_rd_p=1a264172-ae11-42e4-8ef7-7fed1973bb8f&pf_rd_r=MBY5AS7XQMWKBXS6Y8N7&pf_rd_s=center-1&pf_rd_t=15506&pf_rd_i=top&ref_=chttp_tt_175,"A blade runner must pursue and terminate four replicants who stole a ship in space, and have returned to Earth to find their creator.A blade runner must pursue and terminate four replicants who stole a ship in space, and have returned to Earth to find their creator.A blade runner must pursue and terminate four replicants who stole a ship in space, and have returned to Earth to find their creator."
175,Nido de ratas,8.086109806360032,152296,(1954),"Elia Kazan (dir.), Marlon Brando, Karl Malden",https://www.imdb.com/title/tt0047296/?pf_rd_m=A2FGELUUNOQJNL&pf_rd_p=1a264172-ae11-42e4-8ef7-7fed1973bb8f&pf_rd_r=MBY5AS7XQMWKBXS6Y8N7&pf_rd_s=center-1&pf_rd_t=15506&pf_rd_i=top&ref_=chttp_tt_176,"An ex-prize fighter turned New Jersey longshoreman struggles to stand up to his corrupt union bosses, including his older brother, as he starts to connect with the grieving sister of one of ... Read allAn ex-prize fighter turned New Jersey longshoreman struggles to stand up to his corrupt union bosses, including his older brother, as he starts to connect with the grieving sister of one of the syndicate's victims.An ex-prize fighter turned New Jersey longshoreman struggles to stand up to his corrupt union bosses, including his older brother, as he starts to connect with the grieving sister of one of the syndicate's victims."
176,Catch Me If You Can,8.084917912112482,934181,(2002),"Steven Spielberg (dir.), Leonardo DiCaprio, Tom Hanks",https://www.imdb.com/title/tt0264464/?pf_rd_m=A2FGELUUNOQJNL&pf_rd_p=1a264172-ae11-42e4-8ef7-7fed1973bb8f&pf_rd_r=MBY5AS7XQMWKBXS6Y8N7&pf_rd_s=center-1&pf_rd_t=15506&pf_rd_i=top&ref_=chttp_tt_177,"Barely 21 yet, Frank is a skilled forger who has passed as a doctor, lawyer and pilot. FBI agent Carl becomes obsessed with tracking down the con man, who only revels in the pursuit.Barely 21 yet, Frank is a skilled forger who has passed as a doctor, lawyer and pilot. FBI agent Carl becomes obsessed with tracking down the con man, who only revels in the pursuit.Barely 21 yet, Frank is a skilled forger who has passed as a doctor, lawyer and pilot. FBI agent Carl becomes obsessed with tracking down the con man, who only revels in the pursuit."
177,The Third Man,8.083590083771455,169059,(1949),"Carol Reed (dir.), Orson Welles, Joseph Cotten",https://www.imdb.com/title/tt0041959/?pf_rd_m=A2FGELUUNOQJNL&pf_rd_p=1a264172-ae11-42e4-8ef7-7fed1973bb8f&pf_rd_r=MBY5AS7XQMWKBXS6Y8N7&pf_rd_s=center-1&pf_rd_t=15506&pf_rd_i=top&ref_=chttp_tt_178,"Pulp novelist Holly Martins travels to shadowy, postwar Vienna, only to find himself investigating the mysterious death of an old friend, Harry Lime.Pulp novelist Holly Martins travels to shadowy, postwar Vienna, only to find himself investigating the mysterious death of an old friend, Harry Lime.Pulp novelist Holly Martins travels to shadowy, postwar Vienna, only to find himself investigating the mysterious death of an old friend, Harry Lime."
178,Bacheha-Ye aseman,8.081422624764665,73244,(1997),"Majid Majidi (dir.), Mohammad Amir Naji, Amir Farrokh Hashemian",https://www.imdb.com/title/tt0118849/?pf_rd_m=A2FGELUUNOQJNL&pf_rd_p=1a264172-ae11-42e4-8ef7-7fed1973bb8f&pf_rd_r=MBY5AS7XQMWKBXS6Y8N7&pf_rd_s=center-1&pf_rd_t=15506&pf_rd_i=top&ref_=chttp_tt_179,"After a boy loses his sister's pair of shoes, he goes on a series of adventures in order to find them. When he can't, he tries a new way to ""win"" a new pair.After a boy loses his sister's pair of shoes, he goes on a series of adventures in order to find them. When he can't, he tries a new way to ""win"" a new pair.After a boy loses his sister's pair of shoes, he goes on a series of adventures in order to find them. When he can't, he tries a new way to ""win"" a new pair."
179,The General,8.079288992504225,89596,(1926),"Clyde Bruckman (dir.), Buster Keaton, Marion Mack",https://www.imdb.com/title/tt0017925/?pf_rd_m=A2FGELUUNOQJNL&pf_rd_p=1a264172-ae11-42e4-8ef7-7fed1973bb8f&pf_rd_r=MBY5AS7XQMWKBXS6Y8N7&pf_rd_s=center-1&pf_rd_t=15506&pf_rd_i=top&ref_=chttp_tt_180,"After being rejected by the Confederate military, not realizing it was due to his crucial civilian role, an engineer must single-handedly recapture his beloved locomotive after it is seized ... Read allAfter being rejected by the Confederate military, not realizing it was due to his crucial civilian role, an engineer must single-handedly recapture his beloved locomotive after it is seized by Union spies and return it through enemy lines.After being rejected by the Confederate military, not realizing it was due to his crucial civilian role, an engineer must single-handedly recapture his beloved locomotive after it is seized by Union spies and return it through enemy lines."
180,Ben-Hur,8.078925700231254,234785,(1959),"William Wyler (dir.), Charlton Heston, Jack Hawkins",https://www.imdb.com/title/tt0052618/?pf_rd_m=A2FGELUUNOQJNL&pf_rd_p=1a264172-ae11-42e4-8ef7-7fed1973bb8f&pf_rd_r=MBY5AS7XQMWKBXS6Y8N7&pf_rd_s=center-1&pf_rd_t=15506&pf_rd_i=top&ref_=chttp_tt_181,"After a Jewish prince is betrayed and sent into slavery by a Roman friend in 1st-century Jerusalem, he regains his freedom and comes back for revenge.After a Jewish prince is betrayed and sent into slavery by a Roman friend in 1st-century Jerusalem, he regains his freedom and comes back for revenge.After a Jewish prince is betrayed and sent into slavery by a Roman friend in 1st-century Jerusalem, he regains his freedom and comes back for revenge."
181,12 años de esclavitud,8.077974928487931,683921,(2013),"Steve McQueen (dir.), Chiwetel Ejiofor, Michael Kenneth Williams",https://www.imdb.com/title/tt2024544/?pf_rd_m=A2FGELUUNOQJNL&pf_rd_p=1a264172-ae11-42e4-8ef7-7fed1973bb8f&pf_rd_r=MBY5AS7XQMWKBXS6Y8N7&pf_rd_s=center-1&pf_rd_t=15506&pf_rd_i=top&ref_=chttp_tt_182,"In the antebellum United States, Solomon Northup, a free black man from upstate New York, is abducted and sold into slavery.In the antebellum United States, Solomon Northup, a free black man from upstate New York, is abducted and sold into slavery.In the antebellum United States, Solomon Northup, a free black man from upstate New York, is abducted and sold into slavery."
182,Smultronstället,8.07794397298751,105325,(1957),"Ingmar Bergman (dir.), Victor Sjöström, Bibi Andersson",https://www.imdb.com/title/tt0050986/?pf_rd_m=A2FGELUUNOQJNL&pf_rd_p=1a264172-ae11-42e4-8ef7-7fed1973bb8f&pf_rd_r=MBY5AS7XQMWKBXS6Y8N7&pf_rd_s=center-1&pf_rd_t=15506&pf_rd_i=top&ref_=chttp_tt_183,None
183,Perdida,8.077631828057655,947349,(2014),"David Fincher (dir.), Ben Affleck, Rosamund Pike",https://www.imdb.com/title/tt2267998/?pf_rd_m=A2FGELUUNOQJNL&pf_rd_p=1a264172-ae11-42e4-8ef7-7fed1973bb8f&pf_rd_r=MBY5AS7XQMWKBXS6Y8N7&pf_rd_s=center-1&pf_rd_t=15506&pf_rd_i=top&ref_=chttp_tt_184,"With his wife's disappearance having become the focus of an intense media circus, a man sees the spotlight turned on him when it's suspected that he may not be innocent.With his wife's disappearance having become the focus of an intense media circus, a man sees the spotlight turned on him when it's suspected that he may not be innocent.With his wife's disappearance having become the focus of an intense media circus, a man sees the spotlight turned on him when it's suspected that he may not be innocent."
184,The Deer Hunter,8.076237746806585,332783,(1978),"Michael Cimino (dir.), Robert De Niro, Christopher Walken",https://www.imdb.com/title/tt0077416/?pf_rd_m=A2FGELUUNOQJNL&pf_rd_p=1a264172-ae11-42e4-8ef7-7fed1973bb8f&pf_rd_r=MBY5AS7XQMWKBXS6Y8N7&pf_rd_s=center-1&pf_rd_t=15506&pf_rd_i=top&ref_=chttp_tt_185,An in-depth examination of the ways in which the Vietnam War impacts and disrupts the lives of several friends in a small steel mill town in Pennsylvania.An in-depth examination of the ways in which the Vietnam War impacts and disrupts the lives of several friends in a small steel mill town in Pennsylvania.An in-depth examination of the ways in which the Vietnam War impacts and disrupts the lives of several friends in a small steel mill town in Pennsylvania.
185,Before Sunrise,8.07532664982061,297427,(1995),"Richard Linklater (dir.), Ethan Hawke, Julie Delpy",https://www.imdb.com/title/tt0112471/?pf_rd_m=A2FGELUUNOQJNL&pf_rd_p=1a264172-ae11-42e4-8ef7-7fed1973bb8f&pf_rd_r=MBY5AS7XQMWKBXS6Y8N7&pf_rd_s=center-1&pf_rd_t=15506&pf_rd_i=top&ref_=chttp_tt_186,"A young man and woman meet on a train in Europe, and wind up spending one evening together in Vienna. Unfortunately, both know that this will probably be their only night together.A young man and woman meet on a train in Europe, and wind up spending one evening together in Vienna. Unfortunately, both know that this will probably be their only night together.A young man and woman meet on a train in Europe, and wind up spending one evening together in Vienna. Unfortunately, both know that this will probably be their only night together."
186,In the Name of the Father,8.074946324952423,170960,(1993),"Jim Sheridan (dir.), Daniel Day-Lewis, Pete Postlethwaite",https://www.imdb.com/title/tt0107207/?pf_rd_m=A2FGELUUNOQJNL&pf_rd_p=1a264172-ae11-42e4-8ef7-7fed1973bb8f&pf_rd_r=MBY5AS7XQMWKBXS6Y8N7&pf_rd_s=center-1&pf_rd_t=15506&pf_rd_i=top&ref_=chttp_tt_187,None
187,Harry Potter y las reliquias de la muerte: Parte 2,8.074842772257592,841966,(2011),"David Yates (dir.), Daniel Radcliffe, Emma Watson",https://www.imdb.com/title/tt1201607/?pf_rd_m=A2FGELUUNOQJNL&pf_rd_p=1a264172-ae11-42e4-8ef7-7fed1973bb8f&pf_rd_r=MBY5AS7XQMWKBXS6Y8N7&pf_rd_s=center-1&pf_rd_t=15506&pf_rd_i=top&ref_=chttp_tt_188,"Harry, Ron, and Hermione search for Voldemort's remaining Horcruxes in their effort to destroy the Dark Lord as the final battle rages on at Hogwarts.Harry, Ron, and Hermione search for Voldemort's remaining Horcruxes in their effort to destroy the Dark Lord as the final battle rages on at Hogwarts.Harry, Ron, and Hermione search for Voldemort's remaining Horcruxes in their effort to destroy the Dark Lord as the final battle rages on at Hogwarts."
188,Mr. Smith Goes to Washington,8.07263478504643,114040,(1939),"Frank Capra (dir.), James Stewart, Jean Arthur",https://www.imdb.com/title/tt0031679/?pf_rd_m=A2FGELUUNOQJNL&pf_rd_p=1a264172-ae11-42e4-8ef7-7fed1973bb8f&pf_rd_r=MBY5AS7XQMWKBXS6Y8N7&pf_rd_s=center-1&pf_rd_t=15506&pf_rd_i=top&ref_=chttp_tt_189,"A naive youth leader is appointed to fill a vacancy in the U.S. Senate. His idealistic plans promptly collide with corruption at home and subterfuge from his hero in Washington, but he tries... Read allA naive youth leader is appointed to fill a vacancy in the U.S. Senate. His idealistic plans promptly collide with corruption at home and subterfuge from his hero in Washington, but he tries to forge ahead despite attacks on his character.A naive youth leader is appointed to fill a vacancy in the U.S. Senate. His idealistic plans promptly collide with corruption at home and subterfuge from his hero in Washington, but he tries to forge ahead despite attacks on his character."
189,El gran hotel Budapest,8.07154933411872,777869,(2014),"Wes Anderson (dir.), Ralph Fiennes, F. Murray Abraham",https://www.imdb.com/title/tt2278388/?pf_rd_m=A2FGELUUNOQJNL&pf_rd_p=1a264172-ae11-42e4-8ef7-7fed1973bb8f&pf_rd_r=MBY5AS7XQMWKBXS6Y8N7&pf_rd_s=center-1&pf_rd_t=15506&pf_rd_i=top&ref_=chttp_tt_190,"A writer encounters the owner of an aging high-class hotel, who tells him of his early years serving as a lobby boy in the hotel's glorious years under an exceptional concierge.A writer encounters the owner of an aging high-class hotel, who tells him of his early years serving as a lobby boy in the hotel's glorious years under an exceptional concierge.A writer encounters the owner of an aging high-class hotel, who tells him of his early years serving as a lobby boy in the hotel's glorious years under an exceptional concierge."
190,Sherlock Jr.,8.07057311505919,48282,(1924),"Buster Keaton (dir.), Buster Keaton, Kathryn McGuire",https://www.imdb.com/title/tt0015324/?pf_rd_m=A2FGELUUNOQJNL&pf_rd_p=1a264172-ae11-42e4-8ef7-7fed1973bb8f&pf_rd_r=MBY5AS7XQMWKBXS6Y8N7&pf_rd_s=center-1&pf_rd_t=15506&pf_rd_i=top&ref_=chttp_tt_191,"A film projectionist longs to be a detective, and puts his meagre skills to work when he is framed by a rival for stealing his girlfriend's father's pocketwatch.A film projectionist longs to be a detective, and puts his meagre skills to work when he is framed by a rival for stealing his girlfriend's father's pocketwatch.A film projectionist longs to be a detective, and puts his meagre skills to work when he is framed by a rival for stealing his girlfriend's father's pocketwatch."
191,Le salaire de la peur,8.070475476478057,59862,(1953),"Henri-Georges Clouzot (dir.), Yves Montand, Charles Vanel",https://www.imdb.com/title/tt0046268/?pf_rd_m=A2FGELUUNOQJNL&pf_rd_p=1a264172-ae11-42e4-8ef7-7fed1973bb8f&pf_rd_r=MBY5AS7XQMWKBXS6Y8N7&pf_rd_s=center-1&pf_rd_t=15506&pf_rd_i=top&ref_=chttp_tt_192,"In a decrepit South American village, four men are hired to transport an urgent nitroglycerine shipment without the equipment that would make it safe.In a decrepit South American village, four men are hired to transport an urgent nitroglycerine shipment without the equipment that would make it safe.In a decrepit South American village, four men are hired to transport an urgent nitroglycerine shipment without the equipment that would make it safe."
192,La habitación,8.069867843953144,407321,(2015),"Lenny Abrahamson (dir.), Brie Larson, Jacob Tremblay",https://www.imdb.com/title/tt3170832/?pf_rd_m=A2FGELUUNOQJNL&pf_rd_p=1a264172-ae11-42e4-8ef7-7fed1973bb8f&pf_rd_r=MBY5AS7XQMWKBXS6Y8N7&pf_rd_s=center-1&pf_rd_t=15506&pf_rd_i=top&ref_=chttp_tt_193,"Held captive for 7 years in an enclosed space, a woman and her young son finally gain their freedom, allowing the boy to experience the outside world for the first time.Held captive for 7 years in an enclosed space, a woman and her young son finally gain their freedom, allowing the boy to experience the outside world for the first time.Held captive for 7 years in an enclosed space, a woman and her young son finally gain their freedom, allowing the boy to experience the outside world for the first time."
193,Barry Lyndon,8.068581272852205,163513,(1975),"Stanley Kubrick (dir.), Ryan O'Neal, Marisa Berenson",https://www.imdb.com/title/tt0072684/?pf_rd_m=A2FGELUUNOQJNL&pf_rd_p=1a264172-ae11-42e4-8ef7-7fed1973bb8f&pf_rd_r=MBY5AS7XQMWKBXS6Y8N7&pf_rd_s=center-1&pf_rd_t=15506&pf_rd_i=top&ref_=chttp_tt_194,An Irish rogue wins the heart of a rich widow and assumes her dead husband's aristocratic position in 18th-century England.An Irish rogue wins the heart of a rich widow and assumes her dead husband's aristocratic position in 18th-century England.An Irish rogue wins the heart of a rich widow and assumes her dead husband's aristocratic position in 18th-century England.
194,Salinui chueok,8.067825127860969,171456,(2003),"Bong Joon Ho (dir.), Kang-ho Song, Kim Sang-kyung",https://www.imdb.com/title/tt0353969/?pf_rd_m=A2FGELUUNOQJNL&pf_rd_p=1a264172-ae11-42e4-8ef7-7fed1973bb8f&pf_rd_r=MBY5AS7XQMWKBXS6Y8N7&pf_rd_s=center-1&pf_rd_t=15506&pf_rd_i=top&ref_=chttp_tt_195,"In a small Korean province in 1986, two detectives struggle with the case of multiple young women being found raped and murdered by an unknown culprit.In a small Korean province in 1986, two detectives struggle with the case of multiple young women being found raped and murdered by an unknown culprit.In a small Korean province in 1986, two detectives struggle with the case of multiple young women being found raped and murdered by an unknown culprit."
195,Det sjunde inseglet,8.067502038194089,181241,(1957),"Ingmar Bergman (dir.), Max von Sydow, Gunnar Björnstrand",https://www.imdb.com/title/tt0050976/?pf_rd_m=A2FGELUUNOQJNL&pf_rd_p=1a264172-ae11-42e4-8ef7-7fed1973bb8f&pf_rd_r=MBY5AS7XQMWKBXS6Y8N7&pf_rd_s=center-1&pf_rd_t=15506&pf_rd_i=top&ref_=chttp_tt_196,None
196,Hacksaw Ridge,8.066039006494155,498901,(2016),"Mel Gibson (dir.), Andrew Garfield, Sam Worthington",https://www.imdb.com/title/tt2119532/?pf_rd_m=A2FGELUUNOQJNL&pf_rd_p=1a264172-ae11-42e4-8ef7-7fed1973bb8f&pf_rd_r=MBY5AS7XQMWKBXS6Y8N7&pf_rd_s=center-1&pf_rd_t=15506&pf_rd_i=top&ref_=chttp_tt_197,"World War II American Army Medic Desmond T. Doss, who served during the Battle of Okinawa, refuses to kill people and becomes the first man in American history to receive the Medal of Honor ... Read allWorld War II American Army Medic Desmond T. Doss, who served during the Battle of Okinawa, refuses to kill people and becomes the first man in American history to receive the Medal of Honor without firing a shot.World War II American Army Medic Desmond T. Doss, who served during the Battle of Okinawa, refuses to kill people and becomes the first man in American history to receive the Medal of Honor without firing a shot."
197,Relatos salvajes,8.065242448737424,193046,(2014),"Damián Szifron (dir.), Darío Grandinetti, María Marull",https://www.imdb.com/title/tt3011894/?pf_rd_m=A2FGELUUNOQJNL&pf_rd_p=1a264172-ae11-42e4-8ef7-7fed1973bb8f&pf_rd_r=MBY5AS7XQMWKBXS6Y8N7&pf_rd_s=center-1&pf_rd_t=15506&pf_rd_i=top&ref_=chttp_tt_198,Six short stories that explore the extremities of human behavior involving people in distress.Six short stories that explore the extremities of human behavior involving people in distress.Six short stories that explore the extremities of human behavior involving people in distress.
198,Klaus,8.06500803669056,140938,(2019),"Sergio Pablos (dir.), Jason Schwartzman, J.K. Simmons",https://www.imdb.com/title/tt4729430/?pf_rd_m=A2FGELUUNOQJNL&pf_rd_p=1a264172-ae11-42e4-8ef7-7fed1973bb8f&pf_rd_r=MBY5AS7XQMWKBXS6Y8N7&pf_rd_s=center-1&pf_rd_t=15506&pf_rd_i=top&ref_=chttp_tt_199,"A simple act of kindness always sparks another, even in a frozen, faraway place. When Smeerensburg's new postman, Jesper, befriends toymaker Klaus, their gifts melt an age-old feud and deliv... Read allA simple act of kindness always sparks another, even in a frozen, faraway place. When Smeerensburg's new postman, Jesper, befriends toymaker Klaus, their gifts melt an age-old feud and deliver a sleigh full of holiday traditions.A simple act of kindness always sparks another, even in a frozen, faraway place. When Smeerensburg's new postman, Jesper, befriends toymaker Klaus, their gifts melt an age-old feud and deliver a sleigh full of holiday traditions."
199,The Big Lebowski,8.063940491807527,788138,(1998),"Joel Coen (dir.), Jeff Bridges, John Goodman",https://www.imdb.com/title/tt0118715/?pf_rd_m=A2FGELUUNOQJNL&pf_rd_p=1a264172-ae11-42e4-8ef7-7fed1973bb8f&pf_rd_r=MBY5AS7XQMWKBXS6Y8N7&pf_rd_s=center-1&pf_rd_t=15506&pf_rd_i=top&ref_=chttp_tt_200,"Ultimate L.A. slacker Jeff ""The Dude"" Lebowski, mistaken for a millionaire of the same name, seeks restitution for a rug ruined by debt collectors, enlisting his bowling buddies for help whi... Read allUltimate L.A. slacker Jeff ""The Dude"" Lebowski, mistaken for a millionaire of the same name, seeks restitution for a rug ruined by debt collectors, enlisting his bowling buddies for help while trying to find the millionaire's missing wife.Ultimate L.A. slacker Jeff ""The Dude"" Lebowski, mistaken for a millionaire of the same name, seeks restitution for a rug ruined by debt collectors, enlisting his bowling buddies for help while trying to find the millionaire's missing wife."
200,Pather Panchali,8.062420570980034,31169,(1955),"Satyajit Ray (dir.), Kanu Bannerjee, Karuna Bannerjee",https://www.imdb.com/title/tt0048473/?pf_rd_m=A2FGELUUNOQJNL&pf_rd_p=1a264172-ae11-42e4-8ef7-7fed1973bb8f&pf_rd_r=MBY5AS7XQMWKBXS6Y8N7&pf_rd_s=center-1&pf_rd_t=15506&pf_rd_i=top&ref_=chttp_tt_201,"Impoverished priest Harihar Ray, dreaming of a better life for himself and his family, leaves his rural Bengal village in search of work.Impoverished priest Harihar Ray, dreaming of a better life for himself and his family, leaves his rural Bengal village in search of work.Impoverished priest Harihar Ray, dreaming of a better life for himself and his family, leaves his rural Bengal village in search of work."
201,How to Train Your Dragon,8.062081993407016,717069,(2010),"Dean DeBlois (dir.), Jay Baruchel, Gerard Butler",https://www.imdb.com/title/tt0892769/?pf_rd_m=A2FGELUUNOQJNL&pf_rd_p=1a264172-ae11-42e4-8ef7-7fed1973bb8f&pf_rd_r=MBY5AS7XQMWKBXS6Y8N7&pf_rd_s=center-1&pf_rd_t=15506&pf_rd_i=top&ref_=chttp_tt_202,"A hapless young Viking who aspires to hunt dragons becomes the unlikely friend of a young dragon himself, and learns there may be more to the creatures than he assumed.A hapless young Viking who aspires to hunt dragons becomes the unlikely friend of a young dragon himself, and learns there may be more to the creatures than he assumed.A hapless young Viking who aspires to hunt dragons becomes the unlikely friend of a young dragon himself, and learns there may be more to the creatures than he assumed."
