,movie_name,rating,qualifiers,release_year,protagonist_dir,IMDB_link,Summary
135,El laberinto del fauno,8.164252324408505,654515,(2006),"Guillermo del Toro (dir.), Ivana Baquero, Ariadna Gil",https://www.imdb.com/title/tt0457430/?pf_rd_m=A2FGELUUNOQJNL&pf_rd_p=1a264172-ae11-42e4-8ef7-7fed1973bb8f&pf_rd_r=MBY5AS7XQMWKBXS6Y8N7&pf_rd_s=center-1&pf_rd_t=15506&pf_rd_i=top&ref_=chttp_tt_136,"In the Falangist Spain of 1944, the bookish young stepdaughter of a sadistic army officer escapes into an eerie but captivating fantasy world.In the Falangist Spain of 1944, the bookish young stepdaughter of a sadistic army officer escapes into an eerie but captivating fantasy world.In the Falangist Spain of 1944, the bookish young stepdaughter of a sadistic army officer escapes into an eerie but captivating fantasy world."
136,Casino,8.163445677886898,504264,(1995),"Martin Scorsese (dir.), Robert De Niro, Sharon Stone",https://www.imdb.com/title/tt0112641/?pf_rd_m=A2FGELUUNOQJNL&pf_rd_p=1a264172-ae11-42e4-8ef7-7fed1973bb8f&pf_rd_r=MBY5AS7XQMWKBXS6Y8N7&pf_rd_s=center-1&pf_rd_t=15506&pf_rd_i=top&ref_=chttp_tt_137,"A tale of greed, deception, money, power, and murder occur between two best friends: a mafia enforcer and a casino executive compete against each other over a gambling empire, and over a fas... Read allA tale of greed, deception, money, power, and murder occur between two best friends: a mafia enforcer and a casino executive compete against each other over a gambling empire, and over a fast-living and fast-loving socialite.A tale of greed, deception, money, power, and murder occur between two best friends: a mafia enforcer and a casino executive compete against each other over a gambling empire, and over a fast-living and fast-loving socialite."
137,Ran,8.162909245318716,122925,(1985),"Akira Kurosawa (dir.), Tatsuya Nakadai, Akira Terao",https://www.imdb.com/title/tt0089881/?pf_rd_m=A2FGELUUNOQJNL&pf_rd_p=1a264172-ae11-42e4-8ef7-7fed1973bb8f&pf_rd_r=MBY5AS7XQMWKBXS6Y8N7&pf_rd_s=center-1&pf_rd_t=15506&pf_rd_i=top&ref_=chttp_tt_138,"In Medieval Japan, an elderly warlord retires, handing over his empire to his three sons. However, he vastly underestimates how the new-found power will corrupt them and cause them to turn o... Read allIn Medieval Japan, an elderly warlord retires, handing over his empire to his three sons. However, he vastly underestimates how the new-found power will corrupt them and cause them to turn on each other...and him.In Medieval Japan, an elderly warlord retires, handing over his empire to his three sons. However, he vastly underestimates how the new-found power will corrupt them and cause them to turn on each other...and him."
138,Monty Python and the Holy Grail,8.154215614173133,530012,(1975),"Terry Gilliam (dir.), Graham Chapman, John Cleese",https://www.imdb.com/title/tt0071853/?pf_rd_m=A2FGELUUNOQJNL&pf_rd_p=1a264172-ae11-42e4-8ef7-7fed1973bb8f&pf_rd_r=MBY5AS7XQMWKBXS6Y8N7&pf_rd_s=center-1&pf_rd_t=15506&pf_rd_i=top&ref_=chttp_tt_139,"King Arthur and his Knights of the Round Table embark on a surreal, low-budget search for the Holy Grail, encountering many, very silly obstacles.King Arthur and his Knights of the Round Table embark on a surreal, low-budget search for the Holy Grail, encountering many, very silly obstacles.King Arthur and his Knights of the Round Table embark on a surreal, low-budget search for the Holy Grail, encountering many, very silly obstacles."
139,Una mente brillante,8.153738508845718,907450,(2001),"Ron Howard (dir.), Russell Crowe, Ed Harris",https://www.imdb.com/title/tt0268978/?pf_rd_m=A2FGELUUNOQJNL&pf_rd_p=1a264172-ae11-42e4-8ef7-7fed1973bb8f&pf_rd_r=MBY5AS7XQMWKBXS6Y8N7&pf_rd_s=center-1&pf_rd_t=15506&pf_rd_i=top&ref_=chttp_tt_140,"After John Nash, a brilliant but asocial mathematician, accepts secret work in cryptography, his life takes a turn for the nightmarish.After John Nash, a brilliant but asocial mathematician, accepts secret work in cryptography, his life takes a turn for the nightmarish.After John Nash, a brilliant but asocial mathematician, accepts secret work in cryptography, his life takes a turn for the nightmarish."
140,There Will Be Blood,8.15355916325547,567512,(2007),"Paul Thomas Anderson (dir.), Daniel Day-Lewis, Paul Dano",https://www.imdb.com/title/tt0469494/?pf_rd_m=A2FGELUUNOQJNL&pf_rd_p=1a264172-ae11-42e4-8ef7-7fed1973bb8f&pf_rd_r=MBY5AS7XQMWKBXS6Y8N7&pf_rd_s=center-1&pf_rd_t=15506&pf_rd_i=top&ref_=chttp_tt_141,"A story of family, religion, hatred, oil and madness, focusing on a turn-of-the-century prospector in the early days of the business.A story of family, religion, hatred, oil and madness, focusing on a turn-of-the-century prospector in the early days of the business.A story of family, religion, hatred, oil and madness, focusing on a turn-of-the-century prospector in the early days of the business."
141,El Sexto Sentido,8.153458956473736,966216,(1999),"M. Night Shyamalan (dir.), Bruce Willis, Haley Joel Osment",https://www.imdb.com/title/tt0167404/?pf_rd_m=A2FGELUUNOQJNL&pf_rd_p=1a264172-ae11-42e4-8ef7-7fed1973bb8f&pf_rd_r=MBY5AS7XQMWKBXS6Y8N7&pf_rd_s=center-1&pf_rd_t=15506&pf_rd_i=top&ref_=chttp_tt_142,"A frightened, withdrawn Philadelphia boy who communicates with spirits seeks the help of a disheartened child psychologist.A frightened, withdrawn Philadelphia boy who communicates with spirits seeks the help of a disheartened child psychologist.A frightened, withdrawn Philadelphia boy who communicates with spirits seeks the help of a disheartened child psychologist."
142,Yôjinbô,8.149382818527478,120471,(1961),"Akira Kurosawa (dir.), Toshirô Mifune, Eijirô Tôno",https://www.imdb.com/title/tt0055630/?pf_rd_m=A2FGELUUNOQJNL&pf_rd_p=1a264172-ae11-42e4-8ef7-7fed1973bb8f&pf_rd_r=MBY5AS7XQMWKBXS6Y8N7&pf_rd_s=center-1&pf_rd_t=15506&pf_rd_i=top&ref_=chttp_tt_143,A crafty ronin comes to a town divided by two criminal gangs and decides to play them against each other to free the town.A crafty ronin comes to a town divided by two criminal gangs and decides to play them against each other to free the town.A crafty ronin comes to a town divided by two criminal gangs and decides to play them against each other to free the town.
143,The Truman Show,8.149317500256842,1030984,(1998),"Peter Weir (dir.), Jim Carrey, Ed Harris",https://www.imdb.com/title/tt0120382/?pf_rd_m=A2FGELUUNOQJNL&pf_rd_p=1a264172-ae11-42e4-8ef7-7fed1973bb8f&pf_rd_r=MBY5AS7XQMWKBXS6Y8N7&pf_rd_s=center-1&pf_rd_t=15506&pf_rd_i=top&ref_=chttp_tt_144,An insurance salesman discovers his whole life is actually a reality TV show.An insurance salesman discovers his whole life is actually a reality TV show.An insurance salesman discovers his whole life is actually a reality TV show.
144,The Treasure of the Sierra Madre,8.1483600700656,122752,(1948),"John Huston (dir.), Humphrey Bogart, Walter Huston",https://www.imdb.com/title/tt0040897/?pf_rd_m=A2FGELUUNOQJNL&pf_rd_p=1a264172-ae11-42e4-8ef7-7fed1973bb8f&pf_rd_r=MBY5AS7XQMWKBXS6Y8N7&pf_rd_s=center-1&pf_rd_t=15506&pf_rd_i=top&ref_=chttp_tt_145,Two down-on-their-luck Americans searching for work in 1920s Mexico convince an old prospector to help them mine for gold in the Sierra Madre Mountains.Two down-on-their-luck Americans searching for work in 1920s Mexico convince an old prospector to help them mine for gold in the Sierra Madre Mountains.Two down-on-their-luck Americans searching for work in 1920s Mexico convince an old prospector to help them mine for gold in the Sierra Madre Mountains.
145,Rashômon,8.143832205623783,164980,(1950),"Akira Kurosawa (dir.), Toshirô Mifune, Machiko Kyô",https://www.imdb.com/title/tt0042876/?pf_rd_m=A2FGELUUNOQJNL&pf_rd_p=1a264172-ae11-42e4-8ef7-7fed1973bb8f&pf_rd_r=MBY5AS7XQMWKBXS6Y8N7&pf_rd_s=center-1&pf_rd_t=15506&pf_rd_i=top&ref_=chttp_tt_146,"The rape of a bride and the murder of her samurai husband are recalled from the perspectives of a bandit, the bride, the samurai's ghost and a woodcutter.The rape of a bride and the murder of her samurai husband are recalled from the perspectives of a bandit, the bride, the samurai's ghost and a woodcutter.The rape of a bride and the murder of her samurai husband are recalled from the perspectives of a bandit, the bride, the samurai's ghost and a woodcutter."
146,The Great Escape,8.143294414377978,240118,(1963),"John Sturges (dir.), Steve McQueen, James Garner",https://www.imdb.com/title/tt0057115/?pf_rd_m=A2FGELUUNOQJNL&pf_rd_p=1a264172-ae11-42e4-8ef7-7fed1973bb8f&pf_rd_r=MBY5AS7XQMWKBXS6Y8N7&pf_rd_s=center-1&pf_rd_t=15506&pf_rd_i=top&ref_=chttp_tt_147,Allied prisoners of war plan for several hundred of their number to escape from a German camp during World War II.Allied prisoners of war plan for several hundred of their number to escape from a German camp during World War II.Allied prisoners of war plan for several hundred of their number to escape from a German camp during World War II.
147,Shutter Island,8.141050965555678,1252249,(2010),"Martin Scorsese (dir.), Leonardo DiCaprio, Emily Mortimer",https://www.imdb.com/title/tt1130884/?pf_rd_m=A2FGELUUNOQJNL&pf_rd_p=1a264172-ae11-42e4-8ef7-7fed1973bb8f&pf_rd_r=MBY5AS7XQMWKBXS6Y8N7&pf_rd_s=center-1&pf_rd_t=15506&pf_rd_i=top&ref_=chttp_tt_148,"In 1954, a U.S. Marshal investigates the disappearance of a murderer who escaped from a hospital for the criminally insane.In 1954, a U.S. Marshal investigates the disappearance of a murderer who escaped from a hospital for the criminally insane.In 1954, a U.S. Marshal investigates the disappearance of a murderer who escaped from a hospital for the criminally insane."
148,Kill Bill: Vol. 1,8.136829431218048,1080252,(2003),"Quentin Tarantino (dir.), Uma Thurman, David Carradine",https://www.imdb.com/title/tt0266697/?pf_rd_m=A2FGELUUNOQJNL&pf_rd_p=1a264172-ae11-42e4-8ef7-7fed1973bb8f&pf_rd_r=MBY5AS7XQMWKBXS6Y8N7&pf_rd_s=center-1&pf_rd_t=15506&pf_rd_i=top&ref_=chttp_tt_149,"After awakening from a four-year coma, a former assassin wreaks vengeance on the team of assassins who betrayed her.After awakening from a four-year coma, a former assassin wreaks vengeance on the team of assassins who betrayed her.After awakening from a four-year coma, a former assassin wreaks vengeance on the team of assassins who betrayed her."
149,Jurassic Park,8.135744386792526,941890,(1993),"Steven Spielberg (dir.), Sam Neill, Laura Dern",https://www.imdb.com/title/tt0107290/?pf_rd_m=A2FGELUUNOQJNL&pf_rd_p=1a264172-ae11-42e4-8ef7-7fed1973bb8f&pf_rd_r=MBY5AS7XQMWKBXS6Y8N7&pf_rd_s=center-1&pf_rd_t=15506&pf_rd_i=top&ref_=chttp_tt_150,A pragmatic paleontologist touring an almost complete theme park on an island in Central America is tasked with protecting a couple of kids after a power failure causes the park's cloned din... Read allA pragmatic paleontologist touring an almost complete theme park on an island in Central America is tasked with protecting a couple of kids after a power failure causes the park's cloned dinosaurs to run loose.A pragmatic paleontologist touring an almost complete theme park on an island in Central America is tasked with protecting a couple of kids after a power failure causes the park's cloned dinosaurs to run loose.
150,No Country for Old Men,8.134375761649341,937820,(2007),"Ethan Coen (dir.), Tommy Lee Jones, Javier Bardem",https://www.imdb.com/title/tt0477348/?pf_rd_m=A2FGELUUNOQJNL&pf_rd_p=1a264172-ae11-42e4-8ef7-7fed1973bb8f&pf_rd_r=MBY5AS7XQMWKBXS6Y8N7&pf_rd_s=center-1&pf_rd_t=15506&pf_rd_i=top&ref_=chttp_tt_151,Violence and mayhem ensue after a hunter stumbles upon a drug deal gone wrong and more than two million dollars in cash near the Rio Grande.Violence and mayhem ensue after a hunter stumbles upon a drug deal gone wrong and more than two million dollars in cash near the Rio Grande.Violence and mayhem ensue after a hunter stumbles upon a drug deal gone wrong and more than two million dollars in cash near the Rio Grande.
151,The Elephant Man,8.131589845610124,236356,(1980),"David Lynch (dir.), Anthony Hopkins, John Hurt",https://www.imdb.com/title/tt0080678/?pf_rd_m=A2FGELUUNOQJNL&pf_rd_p=1a264172-ae11-42e4-8ef7-7fed1973bb8f&pf_rd_r=MBY5AS7XQMWKBXS6Y8N7&pf_rd_s=center-1&pf_rd_t=15506&pf_rd_i=top&ref_=chttp_tt_152,"A Victorian surgeon rescues a heavily disfigured man who is mistreated while scraping a living as a side-show freak. Behind his monstrous façade, there is revealed a person of kindness, inte... Read allA Victorian surgeon rescues a heavily disfigured man who is mistreated while scraping a living as a side-show freak. Behind his monstrous façade, there is revealed a person of kindness, intelligence and sophistication.A Victorian surgeon rescues a heavily disfigured man who is mistreated while scraping a living as a side-show freak. Behind his monstrous façade, there is revealed a person of kindness, intelligence and sophistication."
152,Raging Bull,8.131175148338027,345035,(1980),"Martin Scorsese (dir.), Robert De Niro, Cathy Moriarty",https://www.imdb.com/title/tt0081398/?pf_rd_m=A2FGELUUNOQJNL&pf_rd_p=1a264172-ae11-42e4-8ef7-7fed1973bb8f&pf_rd_r=MBY5AS7XQMWKBXS6Y8N7&pf_rd_s=center-1&pf_rd_t=15506&pf_rd_i=top&ref_=chttp_tt_153,"The life of boxer Jake LaMotta, whose violence and temper that led him to the top in the ring destroyed his life outside of it.The life of boxer Jake LaMotta, whose violence and temper that led him to the top in the ring destroyed his life outside of it.The life of boxer Jake LaMotta, whose violence and temper that led him to the top in the ring destroyed his life outside of it."
153,Finding Nemo,8.131064154317984,1013766,(2003),"Andrew Stanton (dir.), Albert Brooks, Ellen DeGeneres",https://www.imdb.com/title/tt0266543/?pf_rd_m=A2FGELUUNOQJNL&pf_rd_p=1a264172-ae11-42e4-8ef7-7fed1973bb8f&pf_rd_r=MBY5AS7XQMWKBXS6Y8N7&pf_rd_s=center-1&pf_rd_t=15506&pf_rd_i=top&ref_=chttp_tt_154,"After his son is captured in the Great Barrier Reef and taken to Sydney, a timid clownfish sets out on a journey to bring him home.After his son is captured in the Great Barrier Reef and taken to Sydney, a timid clownfish sets out on a journey to bring him home.After his son is captured in the Great Barrier Reef and taken to Sydney, a timid clownfish sets out on a journey to bring him home."
154,Chinatown,8.129463842752138,318701,(1974),"Roman Polanski (dir.), Jack Nicholson, Faye Dunaway",https://www.imdb.com/title/tt0071315/?pf_rd_m=A2FGELUUNOQJNL&pf_rd_p=1a264172-ae11-42e4-8ef7-7fed1973bb8f&pf_rd_r=MBY5AS7XQMWKBXS6Y8N7&pf_rd_s=center-1&pf_rd_t=15506&pf_rd_i=top&ref_=chttp_tt_155,"A private detective hired to expose an adulterer in 1930s Los Angeles finds himself caught up in a web of deceit, corruption, and murder.A private detective hired to expose an adulterer in 1930s Los Angeles finds himself caught up in a web of deceit, corruption, and murder.A private detective hired to expose an adulterer in 1930s Los Angeles finds himself caught up in a web of deceit, corruption, and murder."
155,Lo que el viento se llevó,8.127706034880923,309339,(1939),"Victor Fleming (dir.), Clark Gable, Vivien Leigh",https://www.imdb.com/title/tt0031381/?pf_rd_m=A2FGELUUNOQJNL&pf_rd_p=1a264172-ae11-42e4-8ef7-7fed1973bb8f&pf_rd_r=MBY5AS7XQMWKBXS6Y8N7&pf_rd_s=center-1&pf_rd_t=15506&pf_rd_i=top&ref_=chttp_tt_156,The manipulative daughter of a Georgia plantation owner conducts a turbulent romance with a roguish profiteer during the American Civil War and Reconstruction periods.The manipulative daughter of a Georgia plantation owner conducts a turbulent romance with a roguish profiteer during the American Civil War and Reconstruction periods.The manipulative daughter of a Georgia plantation owner conducts a turbulent romance with a roguish profiteer during the American Civil War and Reconstruction periods.
156,V de venganza,8.1270561333224,1096140,(2005),"James McTeigue (dir.), Hugo Weaving, Natalie Portman",https://www.imdb.com/title/tt0434409/?pf_rd_m=A2FGELUUNOQJNL&pf_rd_p=1a264172-ae11-42e4-8ef7-7fed1973bb8f&pf_rd_r=MBY5AS7XQMWKBXS6Y8N7&pf_rd_s=center-1&pf_rd_t=15506&pf_rd_i=top&ref_=chttp_tt_157,"In a future British dystopian society, a shadowy freedom fighter, known only by the alias of ""V"", plots to overthrow the tyrannical government - with the help of a young woman.In a future British dystopian society, a shadowy freedom fighter, known only by the alias of ""V"", plots to overthrow the tyrannical government - with the help of a young woman.In a future British dystopian society, a shadowy freedom fighter, known only by the alias of ""V"", plots to overthrow the tyrannical government - with the help of a young woman."
157,Intensa Mente,8.125663230105282,684435,(2015),"Pete Docter (dir.), Amy Poehler, Bill Hader",https://www.imdb.com/title/tt2096673/?pf_rd_m=A2FGELUUNOQJNL&pf_rd_p=1a264172-ae11-42e4-8ef7-7fed1973bb8f&pf_rd_r=MBY5AS7XQMWKBXS6Y8N7&pf_rd_s=center-1&pf_rd_t=15506&pf_rd_i=top&ref_=chttp_tt_158,"After young Riley is uprooted from her Midwest life and moved to San Francisco, her emotions - Joy, Fear, Anger, Disgust and Sadness - conflict on how best to navigate a new city, house, and... Read allAfter young Riley is uprooted from her Midwest life and moved to San Francisco, her emotions - Joy, Fear, Anger, Disgust and Sadness - conflict on how best to navigate a new city, house, and school.After young Riley is uprooted from her Midwest life and moved to San Francisco, her emotions - Joy, Fear, Anger, Disgust and Sadness - conflict on how best to navigate a new city, house, and school."
158,"Lock, Stock and Two Smoking Barrels",8.124399063387601,569493,(1998),"Guy Ritchie (dir.), Jason Flemyng, Dexter Fletcher",https://www.imdb.com/title/tt0120735/?pf_rd_m=A2FGELUUNOQJNL&pf_rd_p=1a264172-ae11-42e4-8ef7-7fed1973bb8f&pf_rd_r=MBY5AS7XQMWKBXS6Y8N7&pf_rd_s=center-1&pf_rd_t=15506&pf_rd_i=top&ref_=chttp_tt_159,"Eddy persuades his three pals to pool money for a vital poker game against a powerful local mobster, Hatchet Harry. Eddy loses, after which Harry gives him a week to pay back 500,000 pounds.Eddy persuades his three pals to pool money for a vital poker game against a powerful local mobster, Hatchet Harry. Eddy loses, after which Harry gives him a week to pay back 500,000 pounds.Eddy persuades his three pals to pool money for a vital poker game against a powerful local mobster, Hatchet Harry. Eddy loses, after which Harry gives him a week to pay back 500,000 pounds."
159,El enigma de otro mundo,8.123262646596844,407938,(1982),"John Carpenter (dir.), Kurt Russell, Wilford Brimley",https://www.imdb.com/title/tt0084787/?pf_rd_m=A2FGELUUNOQJNL&pf_rd_p=1a264172-ae11-42e4-8ef7-7fed1973bb8f&pf_rd_r=MBY5AS7XQMWKBXS6Y8N7&pf_rd_s=center-1&pf_rd_t=15506&pf_rd_i=top&ref_=chttp_tt_160,A research team in Antarctica is hunted by a shape-shifting alien that assumes the appearance of its victims.A research team in Antarctica is hunted by a shape-shifting alien that assumes the appearance of its victims.A research team in Antarctica is hunted by a shape-shifting alien that assumes the appearance of its victims.
160,Batman,8.122751000678047,343092,(2022),"Matt Reeves (dir.), Robert Pattinson, Zoë Kravitz",https://www.imdb.com/title/tt1877830/?pf_rd_m=A2FGELUUNOQJNL&pf_rd_p=1a264172-ae11-42e4-8ef7-7fed1973bb8f&pf_rd_r=MBY5AS7XQMWKBXS6Y8N7&pf_rd_s=center-1&pf_rd_t=15506&pf_rd_i=top&ref_=chttp_tt_161,"When the Riddler, a sadistic serial killer, begins murdering key political figures in Gotham, Batman is forced to investigate the city's hidden corruption and question his family's involveme... Read allWhen the Riddler, a sadistic serial killer, begins murdering key political figures in Gotham, Batman is forced to investigate the city's hidden corruption and question his family's involvement.When the Riddler, a sadistic serial killer, begins murdering key political figures in Gotham, Batman is forced to investigate the city's hidden corruption and question his family's involvement."
161,Dial M for Murder,8.119253179363092,171875,(1954),"Alfred Hitchcock (dir.), Ray Milland, Grace Kelly",https://www.imdb.com/title/tt0046912/?pf_rd_m=A2FGELUUNOQJNL&pf_rd_p=1a264172-ae11-42e4-8ef7-7fed1973bb8f&pf_rd_r=MBY5AS7XQMWKBXS6Y8N7&pf_rd_s=center-1&pf_rd_t=15506&pf_rd_i=top&ref_=chttp_tt_162,A former tennis star arranges the murder of his adulterous wife.A former tennis star arranges the murder of his adulterous wife.A former tennis star arranges the murder of his adulterous wife.
162,El secreto de sus ojos,8.118687707429826,205854,(2009),"Juan José Campanella (dir.), Ricardo Darín, Soledad Villamil",https://www.imdb.com/title/tt1305806/?pf_rd_m=A2FGELUUNOQJNL&pf_rd_p=1a264172-ae11-42e4-8ef7-7fed1973bb8f&pf_rd_r=MBY5AS7XQMWKBXS6Y8N7&pf_rd_s=center-1&pf_rd_t=15506&pf_rd_i=top&ref_=chttp_tt_163,A retired legal counselor writes a novel hoping to find closure for one of his past unresolved homicide cases and for his unreciprocated love with his superior - both of which still haunt hi... Read allA retired legal counselor writes a novel hoping to find closure for one of his past unresolved homicide cases and for his unreciprocated love with his superior - both of which still haunt him decades later.A retired legal counselor writes a novel hoping to find closure for one of his past unresolved homicide cases and for his unreciprocated love with his superior - both of which still haunt him decades later.
163,The Bridge on the River Kwai,8.115905488443088,216520,(1957),"David Lean (dir.), William Holden, Alec Guinness",https://www.imdb.com/title/tt0050212/?pf_rd_m=A2FGELUUNOQJNL&pf_rd_p=1a264172-ae11-42e4-8ef7-7fed1973bb8f&pf_rd_r=MBY5AS7XQMWKBXS6Y8N7&pf_rd_s=center-1&pf_rd_t=15506&pf_rd_i=top&ref_=chttp_tt_164,"British POWs are forced to build a railway bridge across the river Kwai for their Japanese captors in occupied Burma, not knowing that the allied forces are planning a daring commando raid t... Read allBritish POWs are forced to build a railway bridge across the river Kwai for their Japanese captors in occupied Burma, not knowing that the allied forces are planning a daring commando raid through the jungle to destroy it.British POWs are forced to build a railway bridge across the river Kwai for their Japanese captors in occupied Burma, not knowing that the allied forces are planning a daring commando raid through the jungle to destroy it."
164,Hauru no ugoku shiro,8.114062485401973,377051,(2004),"Hayao Miyazaki (dir.), Chieko Baishô, Takuya Kimura",https://www.imdb.com/title/tt0347149/?pf_rd_m=A2FGELUUNOQJNL&pf_rd_p=1a264172-ae11-42e4-8ef7-7fed1973bb8f&pf_rd_r=MBY5AS7XQMWKBXS6Y8N7&pf_rd_s=center-1&pf_rd_t=15506&pf_rd_i=top&ref_=chttp_tt_165,"When an unconfident young woman is cursed with an old body by a spiteful witch, her only chance of breaking the spell lies with a self-indulgent yet insecure young wizard and his companions ... Read allWhen an unconfident young woman is cursed with an old body by a spiteful witch, her only chance of breaking the spell lies with a self-indulgent yet insecure young wizard and his companions in his legged, walking castle.When an unconfident young woman is cursed with an old body by a spiteful witch, her only chance of breaking the spell lies with a self-indulgent yet insecure young wizard and his companions in his legged, walking castle."
165,Trainspotting,8.1118931181144,672064,(1996),"Danny Boyle (dir.), Ewan McGregor, Ewen Bremner",https://www.imdb.com/title/tt0117951/?pf_rd_m=A2FGELUUNOQJNL&pf_rd_p=1a264172-ae11-42e4-8ef7-7fed1973bb8f&pf_rd_r=MBY5AS7XQMWKBXS6Y8N7&pf_rd_s=center-1&pf_rd_t=15506&pf_rd_i=top&ref_=chttp_tt_166,"Renton, deeply immersed in the Edinburgh drug scene, tries to clean up and get out, despite the allure of the drugs and influence of friends.Renton, deeply immersed in the Edinburgh drug scene, tries to clean up and get out, despite the allure of the drugs and influence of friends.Renton, deeply immersed in the Edinburgh drug scene, tries to clean up and get out, despite the allure of the drugs and influence of friends."
166,Tres anúncios por un crimen,8.111877379186097,487904,(2017),"Martin McDonagh (dir.), Frances McDormand, Woody Harrelson",https://www.imdb.com/title/tt5027774/?pf_rd_m=A2FGELUUNOQJNL&pf_rd_p=1a264172-ae11-42e4-8ef7-7fed1973bb8f&pf_rd_r=MBY5AS7XQMWKBXS6Y8N7&pf_rd_s=center-1&pf_rd_t=15506&pf_rd_i=top&ref_=chttp_tt_167,A mother personally challenges the local authorities to solve her daughter's murder when they fail to catch the culprit.A mother personally challenges the local authorities to solve her daughter's murder when they fail to catch the culprit.A mother personally challenges the local authorities to solve her daughter's murder when they fail to catch the culprit.
167,Gran Torino,8.106323330273968,759836,(2008),"Clint Eastwood (dir.), Clint Eastwood, Bee Vang",https://www.imdb.com/title/tt1205489/?pf_rd_m=A2FGELUUNOQJNL&pf_rd_p=1a264172-ae11-42e4-8ef7-7fed1973bb8f&pf_rd_r=MBY5AS7XQMWKBXS6Y8N7&pf_rd_s=center-1&pf_rd_t=15506&pf_rd_i=top&ref_=chttp_tt_168,"Disgruntled Korean War veteran Walt Kowalski sets out to reform his neighbor, Thao Lor, a Hmong teenager who tried to steal Kowalski's prized possession: a 1972 Gran Torino.Disgruntled Korean War veteran Walt Kowalski sets out to reform his neighbor, Thao Lor, a Hmong teenager who tried to steal Kowalski's prized possession: a 1972 Gran Torino.Disgruntled Korean War veteran Walt Kowalski sets out to reform his neighbor, Thao Lor, a Hmong teenager who tried to steal Kowalski's prized possession: a 1972 Gran Torino."
