,movie_name,rating,qualifiers,release_year,protagonist_dir,IMDB_link,Summary
0,The Shawshank Redemption,9.23347291186262,2575113,(1994),"Frank Darabont (dir.), Tim Robbins, Morgan Freeman",https://www.imdb.com/title/tt0111161/?pf_rd_m=A2FGELUUNOQJNL&pf_rd_p=1a264172-ae11-42e4-8ef7-7fed1973bb8f&pf_rd_r=MBY5AS7XQMWKBXS6Y8N7&pf_rd_s=center-1&pf_rd_t=15506&pf_rd_i=top&ref_=chttp_tt_1,"Two imprisoned men bond over a number of years, finding solace and eventual redemption through acts of common decency.Two imprisoned men bond over a number of years, finding solace and eventual redemption through acts of common decency.Two imprisoned men bond over a number of years, finding solace and eventual redemption through acts of common decency."
1,El Padrino,9.155448218349834,1773145,(1972),"Francis Ford Coppola (dir.), Marlon Brando, Al Pacino",https://www.imdb.com/title/tt0068646/?pf_rd_m=A2FGELUUNOQJNL&pf_rd_p=1a264172-ae11-42e4-8ef7-7fed1973bb8f&pf_rd_r=MBY5AS7XQMWKBXS6Y8N7&pf_rd_s=center-1&pf_rd_t=15506&pf_rd_i=top&ref_=chttp_tt_2,The aging patriarch of an organized crime dynasty in postwar New York City transfers control of his clandestine empire to his reluctant youngest son.The aging patriarch of an organized crime dynasty in postwar New York City transfers control of his clandestine empire to his reluctant youngest son.The aging patriarch of an organized crime dynasty in postwar New York City transfers control of his clandestine empire to his reluctant youngest son.
2,The Dark Knight,8.984050239987257,2542361,(2008),"Christopher Nolan (dir.), Christian Bale, Heath Ledger",https://www.imdb.com/title/tt0468569/?pf_rd_m=A2FGELUUNOQJNL&pf_rd_p=1a264172-ae11-42e4-8ef7-7fed1973bb8f&pf_rd_r=MBY5AS7XQMWKBXS6Y8N7&pf_rd_s=center-1&pf_rd_t=15506&pf_rd_i=top&ref_=chttp_tt_3,"When the menace known as the Joker wreaks havoc and chaos on the people of Gotham, Batman must accept one of the greatest psychological and physical tests of his ability to fight injustice.When the menace known as the Joker wreaks havoc and chaos on the people of Gotham, Batman must accept one of the greatest psychological and physical tests of his ability to fight injustice.When the menace known as the Joker wreaks havoc and chaos on the people of Gotham, Batman must accept one of the greatest psychological and physical tests of his ability to fight injustice."
3,El padrino: Parte II,8.983748929947652,1226090,(1974),"Francis Ford Coppola (dir.), Al Pacino, Robert De Niro",https://www.imdb.com/title/tt0071562/?pf_rd_m=A2FGELUUNOQJNL&pf_rd_p=1a264172-ae11-42e4-8ef7-7fed1973bb8f&pf_rd_r=MBY5AS7XQMWKBXS6Y8N7&pf_rd_s=center-1&pf_rd_t=15506&pf_rd_i=top&ref_=chttp_tt_4,"The early life and career of Vito Corleone in 1920s New York City is portrayed, while his son, Michael, expands and tightens his grip on the family crime syndicate.The early life and career of Vito Corleone in 1920s New York City is portrayed, while his son, Michael, expands and tightens his grip on the family crime syndicate.The early life and career of Vito Corleone in 1920s New York City is portrayed, while his son, Michael, expands and tightens his grip on the family crime syndicate."
4,12 Angry Men,8.946256330003889,760527,(1957),"Sidney Lumet (dir.), Henry Fonda, Lee J. Cobb",https://www.imdb.com/title/tt0050083/?pf_rd_m=A2FGELUUNOQJNL&pf_rd_p=1a264172-ae11-42e4-8ef7-7fed1973bb8f&pf_rd_r=MBY5AS7XQMWKBXS6Y8N7&pf_rd_s=center-1&pf_rd_t=15506&pf_rd_i=top&ref_=chttp_tt_5,The jury in a New York City murder trial is frustrated by a single member whose skeptical caution forces them to more carefully consider the evidence before jumping to a hasty verdict.The jury in a New York City murder trial is frustrated by a single member whose skeptical caution forces them to more carefully consider the evidence before jumping to a hasty verdict.The jury in a New York City murder trial is frustrated by a single member whose skeptical caution forces them to more carefully consider the evidence before jumping to a hasty verdict.
5,Schindler's List,8.934483116594274,1311593,(1993),"Steven Spielberg (dir.), Liam Neeson, Ralph Fiennes",https://www.imdb.com/title/tt0108052/?pf_rd_m=A2FGELUUNOQJNL&pf_rd_p=1a264172-ae11-42e4-8ef7-7fed1973bb8f&pf_rd_r=MBY5AS7XQMWKBXS6Y8N7&pf_rd_s=center-1&pf_rd_t=15506&pf_rd_i=top&ref_=chttp_tt_6,"In German-occupied Poland during World War II, industrialist Oskar Schindler gradually becomes concerned for his Jewish workforce after witnessing their persecution by the Nazis.In German-occupied Poland during World War II, industrialist Oskar Schindler gradually becomes concerned for his Jewish workforce after witnessing their persecution by the Nazis.In German-occupied Poland during World War II, industrialist Oskar Schindler gradually becomes concerned for his Jewish workforce after witnessing their persecution by the Nazis."
6,The Lord of the Rings: The Return of the King,8.91961472653689,1771046,(2003),"Peter Jackson (dir.), Elijah Wood, Viggo Mortensen",https://www.imdb.com/title/tt0167260/?pf_rd_m=A2FGELUUNOQJNL&pf_rd_p=1a264172-ae11-42e4-8ef7-7fed1973bb8f&pf_rd_r=MBY5AS7XQMWKBXS6Y8N7&pf_rd_s=center-1&pf_rd_t=15506&pf_rd_i=top&ref_=chttp_tt_7,Gandalf and Aragorn lead the World of Men against Sauron's army to draw his gaze from Frodo and Sam as they approach Mount Doom with the One Ring.Gandalf and Aragorn lead the World of Men against Sauron's army to draw his gaze from Frodo and Sam as they approach Mount Doom with the One Ring.Gandalf and Aragorn lead the World of Men against Sauron's army to draw his gaze from Frodo and Sam as they approach Mount Doom with the One Ring.
7,Pulp Fiction,8.85162313816819,1976330,(1994),"Quentin Tarantino (dir.), John Travolta, Uma Thurman",https://www.imdb.com/title/tt0110912/?pf_rd_m=A2FGELUUNOQJNL&pf_rd_p=1a264172-ae11-42e4-8ef7-7fed1973bb8f&pf_rd_r=MBY5AS7XQMWKBXS6Y8N7&pf_rd_s=center-1&pf_rd_t=15506&pf_rd_i=top&ref_=chttp_tt_8,"The lives of two mob hitmen, a boxer, a gangster and his wife, and a pair of diner bandits intertwine in four tales of violence and redemption.The lives of two mob hitmen, a boxer, a gangster and his wife, and a pair of diner bandits intertwine in four tales of violence and redemption.The lives of two mob hitmen, a boxer, a gangster and his wife, and a pair of diner bandits intertwine in four tales of violence and redemption."
8,The Lord of the Rings: The Fellowship of the Ring,8.802807998845326,1792591,(2001),"Peter Jackson (dir.), Elijah Wood, Ian McKellen",https://www.imdb.com/title/tt0120737/?pf_rd_m=A2FGELUUNOQJNL&pf_rd_p=1a264172-ae11-42e4-8ef7-7fed1973bb8f&pf_rd_r=MBY5AS7XQMWKBXS6Y8N7&pf_rd_s=center-1&pf_rd_t=15506&pf_rd_i=top&ref_=chttp_tt_9,A meek Hobbit from the Shire and eight companions set out on a journey to destroy the powerful One Ring and save Middle-earth from the Dark Lord Sauron.A meek Hobbit from the Shire and eight companions set out on a journey to destroy the powerful One Ring and save Middle-earth from the Dark Lord Sauron.A meek Hobbit from the Shire and eight companions set out on a journey to destroy the powerful One Ring and save Middle-earth from the Dark Lord Sauron.
9,"El bueno, El malo y El feo",8.794474142249927,740105,(1966),"Sergio Leone (dir.), Clint Eastwood, Eli Wallach",https://www.imdb.com/title/tt0060196/?pf_rd_m=A2FGELUUNOQJNL&pf_rd_p=1a264172-ae11-42e4-8ef7-7fed1973bb8f&pf_rd_r=MBY5AS7XQMWKBXS6Y8N7&pf_rd_s=center-1&pf_rd_t=15506&pf_rd_i=top&ref_=chttp_tt_10,A bounty hunting scam joins two men in an uneasy alliance against a third in a race to find a fortune in gold buried in a remote cemetery.A bounty hunting scam joins two men in an uneasy alliance against a third in a race to find a fortune in gold buried in a remote cemetery.A bounty hunting scam joins two men in an uneasy alliance against a third in a race to find a fortune in gold buried in a remote cemetery.
10,Forrest Gump,8.76722254173671,1986444,(1994),"Robert Zemeckis (dir.), Tom Hanks, Robin Wright",https://www.imdb.com/title/tt0109830/?pf_rd_m=A2FGELUUNOQJNL&pf_rd_p=1a264172-ae11-42e4-8ef7-7fed1973bb8f&pf_rd_r=MBY5AS7XQMWKBXS6Y8N7&pf_rd_s=center-1&pf_rd_t=15506&pf_rd_i=top&ref_=chttp_tt_11,"The presidencies of Kennedy and Johnson, the Vietnam War, the Watergate scandal and other historical events unfold from the perspective of an Alabama man with an IQ of 75, whose only desire ... Read allThe presidencies of Kennedy and Johnson, the Vietnam War, the Watergate scandal and other historical events unfold from the perspective of an Alabama man with an IQ of 75, whose only desire is to be reunited with his childhood sweetheart.The presidencies of Kennedy and Johnson, the Vietnam War, the Watergate scandal and other historical events unfold from the perspective of an Alabama man with an IQ of 75, whose only desire is to be reunited with his childhood sweetheart."
11,Fight Club,8.750748721897397,2026709,(1999),"David Fincher (dir.), Brad Pitt, Edward Norton",https://www.imdb.com/title/tt0137523/?pf_rd_m=A2FGELUUNOQJNL&pf_rd_p=1a264172-ae11-42e4-8ef7-7fed1973bb8f&pf_rd_r=MBY5AS7XQMWKBXS6Y8N7&pf_rd_s=center-1&pf_rd_t=15506&pf_rd_i=top&ref_=chttp_tt_12,An insomniac office worker and a devil-may-care soap maker form an underground fight club that evolves into much more.An insomniac office worker and a devil-may-care soap maker form an underground fight club that evolves into much more.An insomniac office worker and a devil-may-care soap maker form an underground fight club that evolves into much more.
12,El origen,8.732941187491036,2260106,(2010),"Christopher Nolan (dir.), Leonardo DiCaprio, Joseph Gordon-Levitt",https://www.imdb.com/title/tt1375666/?pf_rd_m=A2FGELUUNOQJNL&pf_rd_p=1a264172-ae11-42e4-8ef7-7fed1973bb8f&pf_rd_r=MBY5AS7XQMWKBXS6Y8N7&pf_rd_s=center-1&pf_rd_t=15506&pf_rd_i=top&ref_=chttp_tt_13,"A thief who steals corporate secrets through the use of dream-sharing technology is given the inverse task of planting an idea into the mind of a C.E.O., but his tragic past may doom the pro... Read allA thief who steals corporate secrets through the use of dream-sharing technology is given the inverse task of planting an idea into the mind of a C.E.O., but his tragic past may doom the project and his team to disaster.A thief who steals corporate secrets through the use of dream-sharing technology is given the inverse task of planting an idea into the mind of a C.E.O., but his tragic past may doom the project and his team to disaster."
13,The Lord of the Rings: The Two Towers,8.726660587343204,1599857,(2002),"Peter Jackson (dir.), Elijah Wood, Ian McKellen",https://www.imdb.com/title/tt0167261/?pf_rd_m=A2FGELUUNOQJNL&pf_rd_p=1a264172-ae11-42e4-8ef7-7fed1973bb8f&pf_rd_r=MBY5AS7XQMWKBXS6Y8N7&pf_rd_s=center-1&pf_rd_t=15506&pf_rd_i=top&ref_=chttp_tt_14,"While Frodo and Sam edge closer to Mordor with the help of the shifty Gollum, the divided fellowship makes a stand against Sauron's new ally, Saruman, and his hordes of Isengard.While Frodo and Sam edge closer to Mordor with the help of the shifty Gollum, the divided fellowship makes a stand against Sauron's new ally, Saruman, and his hordes of Isengard.While Frodo and Sam edge closer to Mordor with the help of the shifty Gollum, the divided fellowship makes a stand against Sauron's new ally, Saruman, and his hordes of Isengard."
14,El imperio contraataca,8.70188821285999,1245603,(1980),"Irvin Kershner (dir.), Mark Hamill, Harrison Ford",https://www.imdb.com/title/tt0080684/?pf_rd_m=A2FGELUUNOQJNL&pf_rd_p=1a264172-ae11-42e4-8ef7-7fed1973bb8f&pf_rd_r=MBY5AS7XQMWKBXS6Y8N7&pf_rd_s=center-1&pf_rd_t=15506&pf_rd_i=top&ref_=chttp_tt_15,"After the Rebels are brutally overpowered by the Empire on the ice planet Hoth, Luke Skywalker begins Jedi training with Yoda, while his friends are pursued across the galaxy by Darth Vader ... Read allAfter the Rebels are brutally overpowered by the Empire on the ice planet Hoth, Luke Skywalker begins Jedi training with Yoda, while his friends are pursued across the galaxy by Darth Vader and bounty hunter Boba Fett.After the Rebels are brutally overpowered by the Empire on the ice planet Hoth, Luke Skywalker begins Jedi training with Yoda, while his friends are pursued across the galaxy by Darth Vader and bounty hunter Boba Fett."
15,The Matrix,8.671258625465981,1852557,(1999),"Lana Wachowski (dir.), Keanu Reeves, Laurence Fishburne",https://www.imdb.com/title/tt0133093/?pf_rd_m=A2FGELUUNOQJNL&pf_rd_p=1a264172-ae11-42e4-8ef7-7fed1973bb8f&pf_rd_r=MBY5AS7XQMWKBXS6Y8N7&pf_rd_s=center-1&pf_rd_t=15506&pf_rd_i=top&ref_=chttp_tt_16,"When a beautiful stranger leads computer hacker Neo to a forbidding underworld, he discovers the shocking truth--the life he knows is the elaborate deception of an evil cyber-intelligence.When a beautiful stranger leads computer hacker Neo to a forbidding underworld, he discovers the shocking truth--the life he knows is the elaborate deception of an evil cyber-intelligence.When a beautiful stranger leads computer hacker Neo to a forbidding underworld, he discovers the shocking truth--the life he knows is the elaborate deception of an evil cyber-intelligence."
16,Goodfellas,8.6506331976114,1111113,(1990),"Martin Scorsese (dir.), Robert De Niro, Ray Liotta",https://www.imdb.com/title/tt0099685/?pf_rd_m=A2FGELUUNOQJNL&pf_rd_p=1a264172-ae11-42e4-8ef7-7fed1973bb8f&pf_rd_r=MBY5AS7XQMWKBXS6Y8N7&pf_rd_s=center-1&pf_rd_t=15506&pf_rd_i=top&ref_=chttp_tt_17,"The story of Henry Hill and his life in the mob, covering his relationship with his wife Karen Hill and his mob partners Jimmy Conway and Tommy DeVito in the Italian-American crime syndicate... Read allThe story of Henry Hill and his life in the mob, covering his relationship with his wife Karen Hill and his mob partners Jimmy Conway and Tommy DeVito in the Italian-American crime syndicate.The story of Henry Hill and his life in the mob, covering his relationship with his wife Karen Hill and his mob partners Jimmy Conway and Tommy DeVito in the Italian-American crime syndicate."
17,One Flew Over the Cuckoo's Nest,8.641950789522184,980247,(1975),"Milos Forman (dir.), Jack Nicholson, Louise Fletcher",https://www.imdb.com/title/tt0073486/?pf_rd_m=A2FGELUUNOQJNL&pf_rd_p=1a264172-ae11-42e4-8ef7-7fed1973bb8f&pf_rd_r=MBY5AS7XQMWKBXS6Y8N7&pf_rd_s=center-1&pf_rd_t=15506&pf_rd_i=top&ref_=chttp_tt_18,"A criminal pleads insanity and is admitted to a mental institution, where he rebels against the oppressive nurse and rallies up the scared patients.A criminal pleads insanity and is admitted to a mental institution, where he rebels against the oppressive nurse and rallies up the scared patients.A criminal pleads insanity and is admitted to a mental institution, where he rebels against the oppressive nurse and rallies up the scared patients."
18,Se7en,8.603680192165715,1579556,(1995),"David Fincher (dir.), Morgan Freeman, Brad Pitt",https://www.imdb.com/title/tt0114369/?pf_rd_m=A2FGELUUNOQJNL&pf_rd_p=1a264172-ae11-42e4-8ef7-7fed1973bb8f&pf_rd_r=MBY5AS7XQMWKBXS6Y8N7&pf_rd_s=center-1&pf_rd_t=15506&pf_rd_i=top&ref_=chttp_tt_19,"Two detectives, a rookie and a veteran, hunt a serial killer who uses the seven deadly sins as his motives.Two detectives, a rookie and a veteran, hunt a serial killer who uses the seven deadly sins as his motives.Two detectives, a rookie and a veteran, hunt a serial killer who uses the seven deadly sins as his motives."
19,Shichinin no samurai,8.599490432779366,338006,(1954),"Akira Kurosawa (dir.), Toshirô Mifune, Takashi Shimura",https://www.imdb.com/title/tt0047478/?pf_rd_m=A2FGELUUNOQJNL&pf_rd_p=1a264172-ae11-42e4-8ef7-7fed1973bb8f&pf_rd_r=MBY5AS7XQMWKBXS6Y8N7&pf_rd_s=center-1&pf_rd_t=15506&pf_rd_i=top&ref_=chttp_tt_20,A poor village under attack by bandits recruits seven unemployed samurai to help them defend themselves.A poor village under attack by bandits recruits seven unemployed samurai to help them defend themselves.A poor village under attack by bandits recruits seven unemployed samurai to help them defend themselves.
20,It's a Wonderful Life,8.597381179185735,443452,(1946),"Frank Capra (dir.), James Stewart, Donna Reed",https://www.imdb.com/title/tt0038650/?pf_rd_m=A2FGELUUNOQJNL&pf_rd_p=1a264172-ae11-42e4-8ef7-7fed1973bb8f&pf_rd_r=MBY5AS7XQMWKBXS6Y8N7&pf_rd_s=center-1&pf_rd_t=15506&pf_rd_i=top&ref_=chttp_tt_21,An angel is sent from Heaven to help a desperately frustrated businessman by showing him what life would have been like if he had never existed.An angel is sent from Heaven to help a desperately frustrated businessman by showing him what life would have been like if he had never existed.An angel is sent from Heaven to help a desperately frustrated businessman by showing him what life would have been like if he had never existed.
21,The Silence of the Lambs,8.58797291082855,1380234,(1991),"Jonathan Demme (dir.), Jodie Foster, Anthony Hopkins",https://www.imdb.com/title/tt0102926/?pf_rd_m=A2FGELUUNOQJNL&pf_rd_p=1a264172-ae11-42e4-8ef7-7fed1973bb8f&pf_rd_r=MBY5AS7XQMWKBXS6Y8N7&pf_rd_s=center-1&pf_rd_t=15506&pf_rd_i=top&ref_=chttp_tt_22,"A young F.B.I. cadet must receive the help of an incarcerated and manipulative cannibal killer to help catch another serial killer, a madman who skins his victims.A young F.B.I. cadet must receive the help of an incarcerated and manipulative cannibal killer to help catch another serial killer, a madman who skins his victims.A young F.B.I. cadet must receive the help of an incarcerated and manipulative cannibal killer to help catch another serial killer, a madman who skins his victims."
22,Cidade de Deus,8.57912661609765,739266,(2002),"Fernando Meirelles (dir.), Alexandre Rodrigues, Leandro Firmino",https://www.imdb.com/title/tt0317248/?pf_rd_m=A2FGELUUNOQJNL&pf_rd_p=1a264172-ae11-42e4-8ef7-7fed1973bb8f&pf_rd_r=MBY5AS7XQMWKBXS6Y8N7&pf_rd_s=center-1&pf_rd_t=15506&pf_rd_i=top&ref_=chttp_tt_23,"In the slums of Rio, two kids' paths diverge as one struggles to become a photographer and the other a kingpin.In the slums of Rio, two kids' paths diverge as one struggles to become a photographer and the other a kingpin.In the slums of Rio, two kids' paths diverge as one struggles to become a photographer and the other a kingpin."
23,Saving Private Ryan,8.57695985702569,1341388,(1998),"Steven Spielberg (dir.), Tom Hanks, Matt Damon",https://www.imdb.com/title/tt0120815/?pf_rd_m=A2FGELUUNOQJNL&pf_rd_p=1a264172-ae11-42e4-8ef7-7fed1973bb8f&pf_rd_r=MBY5AS7XQMWKBXS6Y8N7&pf_rd_s=center-1&pf_rd_t=15506&pf_rd_i=top&ref_=chttp_tt_24,"Following the Normandy Landings, a group of U.S. soldiers go behind enemy lines to retrieve a paratrooper whose brothers have been killed in action.Following the Normandy Landings, a group of U.S. soldiers go behind enemy lines to retrieve a paratrooper whose brothers have been killed in action.Following the Normandy Landings, a group of U.S. soldiers go behind enemy lines to retrieve a paratrooper whose brothers have been killed in action."
24,La vita è bella,8.565959638370186,674245,(1997),"Roberto Benigni (dir.), Roberto Benigni, Nicoletta Braschi",https://www.imdb.com/title/tt0118799/?pf_rd_m=A2FGELUUNOQJNL&pf_rd_p=1a264172-ae11-42e4-8ef7-7fed1973bb8f&pf_rd_r=MBY5AS7XQMWKBXS6Y8N7&pf_rd_s=center-1&pf_rd_t=15506&pf_rd_i=top&ref_=chttp_tt_25,"When an open-minded Jewish waiter and his son become victims of the Holocaust, he uses a perfect mixture of will, humor, and imagination to protect his son from the dangers around their camp... Read allWhen an open-minded Jewish waiter and his son become victims of the Holocaust, he uses a perfect mixture of will, humor, and imagination to protect his son from the dangers around their camp.When an open-minded Jewish waiter and his son become victims of the Holocaust, he uses a perfect mixture of will, humor, and imagination to protect his son from the dangers around their camp."
25,The Green Mile,8.55890751961577,1252265,(1999),"Frank Darabont (dir.), Tom Hanks, Michael Clarke Duncan",https://www.imdb.com/title/tt0120689/?pf_rd_m=A2FGELUUNOQJNL&pf_rd_p=1a264172-ae11-42e4-8ef7-7fed1973bb8f&pf_rd_r=MBY5AS7XQMWKBXS6Y8N7&pf_rd_s=center-1&pf_rd_t=15506&pf_rd_i=top&ref_=chttp_tt_26,"The lives of guards on Death Row are affected by one of their charges: a black man accused of child murder and rape, yet who has a mysterious gift.The lives of guards on Death Row are affected by one of their charges: a black man accused of child murder and rape, yet who has a mysterious gift.The lives of guards on Death Row are affected by one of their charges: a black man accused of child murder and rape, yet who has a mysterious gift."
26,La guerra de las galaxias,8.555194516181977,1317119,(1977),"George Lucas (dir.), Mark Hamill, Harrison Ford",https://www.imdb.com/title/tt0076759/?pf_rd_m=A2FGELUUNOQJNL&pf_rd_p=1a264172-ae11-42e4-8ef7-7fed1973bb8f&pf_rd_r=MBY5AS7XQMWKBXS6Y8N7&pf_rd_s=center-1&pf_rd_t=15506&pf_rd_i=top&ref_=chttp_tt_27,"Luke Skywalker joins forces with a Jedi Knight, a cocky pilot, a Wookiee and two droids to save the galaxy from the Empire's world-destroying battle station, while also attempting to rescue ... Read allLuke Skywalker joins forces with a Jedi Knight, a cocky pilot, a Wookiee and two droids to save the galaxy from the Empire's world-destroying battle station, while also attempting to rescue Princess Leia from the mysterious Darth Vader.Luke Skywalker joins forces with a Jedi Knight, a cocky pilot, a Wookiee and two droids to save the galaxy from the Empire's world-destroying battle station, while also attempting to rescue Princess Leia from the mysterious Darth Vader."
27,Interestelar,8.552732912250226,1719280,(2014),"Christopher Nolan (dir.), Matthew McConaughey, Anne Hathaway",https://www.imdb.com/title/tt0816692/?pf_rd_m=A2FGELUUNOQJNL&pf_rd_p=1a264172-ae11-42e4-8ef7-7fed1973bb8f&pf_rd_r=MBY5AS7XQMWKBXS6Y8N7&pf_rd_s=center-1&pf_rd_t=15506&pf_rd_i=top&ref_=chttp_tt_28,A team of explorers travel through a wormhole in space in an attempt to ensure humanity's survival.A team of explorers travel through a wormhole in space in an attempt to ensure humanity's survival.A team of explorers travel through a wormhole in space in an attempt to ensure humanity's survival.
28,Terminator 2: Judgment Day,8.534483679250927,1064586,(1991),"James Cameron (dir.), Arnold Schwarzenegger, Linda Hamilton",https://www.imdb.com/title/tt0103064/?pf_rd_m=A2FGELUUNOQJNL&pf_rd_p=1a264172-ae11-42e4-8ef7-7fed1973bb8f&pf_rd_r=MBY5AS7XQMWKBXS6Y8N7&pf_rd_s=center-1&pf_rd_t=15506&pf_rd_i=top&ref_=chttp_tt_29,"A cyborg, identical to the one who failed to kill Sarah Connor, must now protect her ten-year-old son John from a more advanced and powerful cyborg.A cyborg, identical to the one who failed to kill Sarah Connor, must now protect her ten-year-old son John from a more advanced and powerful cyborg.A cyborg, identical to the one who failed to kill Sarah Connor, must now protect her ten-year-old son John from a more advanced and powerful cyborg."
29,Back to the Future,8.51768611244924,1155921,(1985),"Robert Zemeckis (dir.), Michael J. Fox, Christopher Lloyd",https://www.imdb.com/title/tt0088763/?pf_rd_m=A2FGELUUNOQJNL&pf_rd_p=1a264172-ae11-42e4-8ef7-7fed1973bb8f&pf_rd_r=MBY5AS7XQMWKBXS6Y8N7&pf_rd_s=center-1&pf_rd_t=15506&pf_rd_i=top&ref_=chttp_tt_30,"Marty McFly, a 17-year-old high school student, is accidentally sent thirty years into the past in a time-traveling DeLorean invented by his close friend, the eccentric scientist Doc Brown.Marty McFly, a 17-year-old high school student, is accidentally sent thirty years into the past in a time-traveling DeLorean invented by his close friend, the eccentric scientist Doc Brown.Marty McFly, a 17-year-old high school student, is accidentally sent thirty years into the past in a time-traveling DeLorean invented by his close friend, the eccentric scientist Doc Brown."
30,El viaje de Chihiro,8.515051794216166,728269,(2001),"Hayao Miyazaki (dir.), Daveigh Chase, Suzanne Pleshette",https://www.imdb.com/title/tt0245429/?pf_rd_m=A2FGELUUNOQJNL&pf_rd_p=1a264172-ae11-42e4-8ef7-7fed1973bb8f&pf_rd_r=MBY5AS7XQMWKBXS6Y8N7&pf_rd_s=center-1&pf_rd_t=15506&pf_rd_i=top&ref_=chttp_tt_31,"During her family's move to the suburbs, a sullen 10-year-old girl wanders into a world ruled by gods, witches, and spirits, and where humans are changed into beasts.During her family's move to the suburbs, a sullen 10-year-old girl wanders into a world ruled by gods, witches, and spirits, and where humans are changed into beasts.During her family's move to the suburbs, a sullen 10-year-old girl wanders into a world ruled by gods, witches, and spirits, and where humans are changed into beasts."
31,Psycho,8.508845120521192,651077,(1960),"Alfred Hitchcock (dir.), Anthony Perkins, Janet Leigh",https://www.imdb.com/title/tt0054215/?pf_rd_m=A2FGELUUNOQJNL&pf_rd_p=1a264172-ae11-42e4-8ef7-7fed1973bb8f&pf_rd_r=MBY5AS7XQMWKBXS6Y8N7&pf_rd_s=center-1&pf_rd_t=15506&pf_rd_i=top&ref_=chttp_tt_32,"A Phoenix secretary embezzles $40,000 from her employer's client, goes on the run, and checks into a remote motel run by a young man under the domination of his mother.A Phoenix secretary embezzles $40,000 from her employer's client, goes on the run, and checks into a remote motel run by a young man under the domination of his mother.A Phoenix secretary embezzles $40,000 from her employer's client, goes on the run, and checks into a remote motel run by a young man under the domination of his mother."
