,movie_name,rating,qualifiers,release_year,protagonist_dir,IMDB_link,Summary
68,Spider-Man: un nuevo uiverso,8.326143845426216,484394,(2018),"Bob Persichetti (dir.), Shameik Moore, Jake Johnson",https://www.imdb.com/title/tt4633694/?pf_rd_m=A2FGELUUNOQJNL&pf_rd_p=1a264172-ae11-42e4-8ef7-7fed1973bb8f&pf_rd_r=MBY5AS7XQMWKBXS6Y8N7&pf_rd_s=center-1&pf_rd_t=15506&pf_rd_i=top&ref_=chttp_tt_69,"Teen Miles Morales becomes the Spider-Man of his universe, and must join with five spider-powered individuals from other dimensions to stop a threat for all realities.Teen Miles Morales becomes the Spider-Man of his universe, and must join with five spider-powered individuals from other dimensions to stop a threat for all realities.Teen Miles Morales becomes the Spider-Man of his universe, and must join with five spider-powered individuals from other dimensions to stop a threat for all realities."
69,Guasón,8.321378504857996,1179368,(2019),"Todd Phillips (dir.), Joaquin Phoenix, Robert De Niro",https://www.imdb.com/title/tt7286456/?pf_rd_m=A2FGELUUNOQJNL&pf_rd_p=1a264172-ae11-42e4-8ef7-7fed1973bb8f&pf_rd_r=MBY5AS7XQMWKBXS6Y8N7&pf_rd_s=center-1&pf_rd_t=15506&pf_rd_i=top&ref_=chttp_tt_70,A mentally troubled stand-up comedian embarks on a downward spiral that leads to the creation of an iconic villain.A mentally troubled stand-up comedian embarks on a downward spiral that leads to the creation of an iconic villain.A mentally troubled stand-up comedian embarks on a downward spiral that leads to the creation of an iconic villain.
70,Oldeuboi,8.32004731235378,559884,(2003),"Park Chan-wook (dir.), Choi Min-sik, Yoo Ji-Tae",https://www.imdb.com/title/tt0364569/?pf_rd_m=A2FGELUUNOQJNL&pf_rd_p=1a264172-ae11-42e4-8ef7-7fed1973bb8f&pf_rd_r=MBY5AS7XQMWKBXS6Y8N7&pf_rd_s=center-1&pf_rd_t=15506&pf_rd_i=top&ref_=chttp_tt_71,"After being kidnapped and imprisoned for fifteen years, Oh Dae-Su is released, only to find that he must find his captor in five days.After being kidnapped and imprisoned for fifteen years, Oh Dae-Su is released, only to find that he must find his captor in five days.After being kidnapped and imprisoned for fifteen years, Oh Dae-Su is released, only to find that he must find his captor in five days."
71,Braveheart,8.315884282544816,1014326,(1995),"Mel Gibson (dir.), Mel Gibson, Sophie Marceau",https://www.imdb.com/title/tt0112573/?pf_rd_m=A2FGELUUNOQJNL&pf_rd_p=1a264172-ae11-42e4-8ef7-7fed1973bb8f&pf_rd_r=MBY5AS7XQMWKBXS6Y8N7&pf_rd_s=center-1&pf_rd_t=15506&pf_rd_i=top&ref_=chttp_tt_72,Scottish warrior William Wallace leads his countrymen in a rebellion to free his homeland from the tyranny of King Edward I of England.Scottish warrior William Wallace leads his countrymen in a rebellion to free his homeland from the tyranny of King Edward I of England.Scottish warrior William Wallace leads his countrymen in a rebellion to free his homeland from the tyranny of King Edward I of England.
72,Amadeus,8.315185950187644,392461,(1984),"Milos Forman (dir.), F. Murray Abraham, Tom Hulce",https://www.imdb.com/title/tt0086879/?pf_rd_m=A2FGELUUNOQJNL&pf_rd_p=1a264172-ae11-42e4-8ef7-7fed1973bb8f&pf_rd_r=MBY5AS7XQMWKBXS6Y8N7&pf_rd_s=center-1&pf_rd_t=15506&pf_rd_i=top&ref_=chttp_tt_73,"The life, success and troubles of Wolfgang Amadeus Mozart, as told by Antonio Salieri, the contemporaneous composer who was insanely jealous of Mozart's talent and claimed to have murdered h... Read allThe life, success and troubles of Wolfgang Amadeus Mozart, as told by Antonio Salieri, the contemporaneous composer who was insanely jealous of Mozart's talent and claimed to have murdered him.The life, success and troubles of Wolfgang Amadeus Mozart, as told by Antonio Salieri, the contemporaneous composer who was insanely jealous of Mozart's talent and claimed to have murdered him."
73,Toy Story,8.314162165766566,959851,(1995),"John Lasseter (dir.), Tom Hanks, Tim Allen",https://www.imdb.com/title/tt0114709/?pf_rd_m=A2FGELUUNOQJNL&pf_rd_p=1a264172-ae11-42e4-8ef7-7fed1973bb8f&pf_rd_r=MBY5AS7XQMWKBXS6Y8N7&pf_rd_s=center-1&pf_rd_t=15506&pf_rd_i=top&ref_=chttp_tt_74,A cowboy doll is profoundly threatened and jealous when a new spaceman figure supplants him as top toy in a boy's room.A cowboy doll is profoundly threatened and jealous when a new spaceman figure supplants him as top toy in a boy's room.A cowboy doll is profoundly threatened and jealous when a new spaceman figure supplants him as top toy in a boy's room.
74,Das Boot,8.31242388793171,246446,(1981),"Wolfgang Petersen (dir.), Jürgen Prochnow, Herbert Grönemeyer",https://www.imdb.com/title/tt0082096/?pf_rd_m=A2FGELUUNOQJNL&pf_rd_p=1a264172-ae11-42e4-8ef7-7fed1973bb8f&pf_rd_r=MBY5AS7XQMWKBXS6Y8N7&pf_rd_s=center-1&pf_rd_t=15506&pf_rd_i=top&ref_=chttp_tt_75,"The claustrophobic world of a WWII German U-boat; boredom, filth and sheer terror.The claustrophobic world of a WWII German U-boat; boredom, filth and sheer terror.The claustrophobic world of a WWII German U-boat; boredom, filth and sheer terror."
75,Coco,8.31203512706055,473213,(2017),"Lee Unkrich (dir.), Anthony Gonzalez, Gael García Bernal",https://www.imdb.com/title/tt2380307/?pf_rd_m=A2FGELUUNOQJNL&pf_rd_p=1a264172-ae11-42e4-8ef7-7fed1973bb8f&pf_rd_r=MBY5AS7XQMWKBXS6Y8N7&pf_rd_s=center-1&pf_rd_t=15506&pf_rd_i=top&ref_=chttp_tt_76,"Aspiring musician Miguel, confronted with his family's ancestral ban on music, enters the Land of the Dead to find his great-great-grandfather, a legendary singer.Aspiring musician Miguel, confronted with his family's ancestral ban on music, enters the Land of the Dead to find his great-great-grandfather, a legendary singer.Aspiring musician Miguel, confronted with his family's ancestral ban on music, enters the Land of the Dead to find his great-great-grandfather, a legendary singer."
76,Bastardos Sin Gloria,8.309735058500536,1388399,(2009),"Quentin Tarantino (dir.), Brad Pitt, Diane Kruger",https://www.imdb.com/title/tt0361748/?pf_rd_m=A2FGELUUNOQJNL&pf_rd_p=1a264172-ae11-42e4-8ef7-7fed1973bb8f&pf_rd_r=MBY5AS7XQMWKBXS6Y8N7&pf_rd_s=center-1&pf_rd_t=15506&pf_rd_i=top&ref_=chttp_tt_77,"In Nazi-occupied France during World War II, a plan to assassinate Nazi leaders by a group of Jewish U.S. soldiers coincides with a theatre owner's vengeful plans for the same.In Nazi-occupied France during World War II, a plan to assassinate Nazi leaders by a group of Jewish U.S. soldiers coincides with a theatre owner's vengeful plans for the same.In Nazi-occupied France during World War II, a plan to assassinate Nazi leaders by a group of Jewish U.S. soldiers coincides with a theatre owner's vengeful plans for the same."
77,Mononoke-hime,8.30371791537581,380351,(1997),"Hayao Miyazaki (dir.), Yôji Matsuda, Yuriko Ishida",https://www.imdb.com/title/tt0119698/?pf_rd_m=A2FGELUUNOQJNL&pf_rd_p=1a264172-ae11-42e4-8ef7-7fed1973bb8f&pf_rd_r=MBY5AS7XQMWKBXS6Y8N7&pf_rd_s=center-1&pf_rd_t=15506&pf_rd_i=top&ref_=chttp_tt_78,"On a journey to find the cure for a Tatarigami's curse, Ashitaka finds himself in the middle of a war between the forest gods and Tatara, a mining colony. In this quest he also meets San, th... Read allOn a journey to find the cure for a Tatarigami's curse, Ashitaka finds himself in the middle of a war between the forest gods and Tatara, a mining colony. In this quest he also meets San, the Mononoke Hime.On a journey to find the cure for a Tatarigami's curse, Ashitaka finds himself in the middle of a war between the forest gods and Tatara, a mining colony. In this quest he also meets San, the Mononoke Hime."
78,Érase una vez en América,8.302819723018919,341587,(1984),"Sergio Leone (dir.), Robert De Niro, James Woods",https://www.imdb.com/title/tt0087843/?pf_rd_m=A2FGELUUNOQJNL&pf_rd_p=1a264172-ae11-42e4-8ef7-7fed1973bb8f&pf_rd_r=MBY5AS7XQMWKBXS6Y8N7&pf_rd_s=center-1&pf_rd_t=15506&pf_rd_i=top&ref_=chttp_tt_79,"A former Prohibition-era Jewish gangster returns to the Lower East Side of Manhattan 35 years later, where he must once again confront the ghosts and regrets of his old life.A former Prohibition-era Jewish gangster returns to the Lower East Side of Manhattan 35 years later, where he must once again confront the ghosts and regrets of his old life.A former Prohibition-era Jewish gangster returns to the Lower East Side of Manhattan 35 years later, where he must once again confront the ghosts and regrets of his old life."
79,Avengers: Endgame,8.299379298076357,1040023,(2019),"Anthony Russo (dir.), Robert Downey Jr., Chris Evans",https://www.imdb.com/title/tt4154796/?pf_rd_m=A2FGELUUNOQJNL&pf_rd_p=1a264172-ae11-42e4-8ef7-7fed1973bb8f&pf_rd_r=MBY5AS7XQMWKBXS6Y8N7&pf_rd_s=center-1&pf_rd_t=15506&pf_rd_i=top&ref_=chttp_tt_80,"After the devastating events of Avengers: Infinity War (2018), the universe is in ruins. With the help of remaining allies, the Avengers assemble once more in order to reverse Thanos' action... Read allAfter the devastating events of Avengers: Infinity War (2018), the universe is in ruins. With the help of remaining allies, the Avengers assemble once more in order to reverse Thanos' actions and restore balance to the universe.After the devastating events of Avengers: Infinity War (2018), the universe is in ruins. With the help of remaining allies, the Avengers assemble once more in order to reverse Thanos' actions and restore balance to the universe."
80,Good Will Hunting,8.28559796821884,934034,(1997),"Gus Van Sant (dir.), Robin Williams, Matt Damon",https://www.imdb.com/title/tt0119217/?pf_rd_m=A2FGELUUNOQJNL&pf_rd_p=1a264172-ae11-42e4-8ef7-7fed1973bb8f&pf_rd_r=MBY5AS7XQMWKBXS6Y8N7&pf_rd_s=center-1&pf_rd_t=15506&pf_rd_i=top&ref_=chttp_tt_81,"Will Hunting, a janitor at M.I.T., has a gift for mathematics, but needs help from a psychologist to find direction in his life.Will Hunting, a janitor at M.I.T., has a gift for mathematics, but needs help from a psychologist to find direction in his life.Will Hunting, a janitor at M.I.T., has a gift for mathematics, but needs help from a psychologist to find direction in his life."
81,Requiem for a Dream,8.278166068905982,818368,(2000),"Darren Aronofsky (dir.), Ellen Burstyn, Jared Leto",https://www.imdb.com/title/tt0180093/?pf_rd_m=A2FGELUUNOQJNL&pf_rd_p=1a264172-ae11-42e4-8ef7-7fed1973bb8f&pf_rd_r=MBY5AS7XQMWKBXS6Y8N7&pf_rd_s=center-1&pf_rd_t=15506&pf_rd_i=top&ref_=chttp_tt_82,The drug-induced utopias of four Coney Island people are shattered when their addictions run deep.The drug-induced utopias of four Coney Island people are shattered when their addictions run deep.The drug-induced utopias of four Coney Island people are shattered when their addictions run deep.
82,Toy Story 3,8.277616534652465,810872,(2010),"Lee Unkrich (dir.), Tom Hanks, Tim Allen",https://www.imdb.com/title/tt0435761/?pf_rd_m=A2FGELUUNOQJNL&pf_rd_p=1a264172-ae11-42e4-8ef7-7fed1973bb8f&pf_rd_r=MBY5AS7XQMWKBXS6Y8N7&pf_rd_s=center-1&pf_rd_t=15506&pf_rd_i=top&ref_=chttp_tt_83,"The toys are mistakenly delivered to a day-care center instead of the attic right before Andy leaves for college, and it's up to Woody to convince the other toys that they weren't abandoned ... Read allThe toys are mistakenly delivered to a day-care center instead of the attic right before Andy leaves for college, and it's up to Woody to convince the other toys that they weren't abandoned and to return home.The toys are mistakenly delivered to a day-care center instead of the attic right before Andy leaves for college, and it's up to Woody to convince the other toys that they weren't abandoned and to return home."
83,Singin' in the Rain,8.273964040568364,236194,(1952),"Stanley Donen (dir.), Gene Kelly, Donald O'Connor",https://www.imdb.com/title/tt0045152/?pf_rd_m=A2FGELUUNOQJNL&pf_rd_p=1a264172-ae11-42e4-8ef7-7fed1973bb8f&pf_rd_r=MBY5AS7XQMWKBXS6Y8N7&pf_rd_s=center-1&pf_rd_t=15506&pf_rd_i=top&ref_=chttp_tt_84,A silent film star falls for a chorus girl just as he and his delusionally jealous screen partner are trying to make the difficult transition to talking pictures in 1920s Hollywood.A silent film star falls for a chorus girl just as he and his delusionally jealous screen partner are trying to make the difficult transition to talking pictures in 1920s Hollywood.A silent film star falls for a chorus girl just as he and his delusionally jealous screen partner are trying to make the difficult transition to talking pictures in 1920s Hollywood.
84,Tu Nombre,8.272631229189722,247692,(2016),"Makoto Shinkai (dir.), Ryûnosuke Kamiki, Mone Kamishiraishi",https://www.imdb.com/title/tt5311514/?pf_rd_m=A2FGELUUNOQJNL&pf_rd_p=1a264172-ae11-42e4-8ef7-7fed1973bb8f&pf_rd_r=MBY5AS7XQMWKBXS6Y8N7&pf_rd_s=center-1&pf_rd_t=15506&pf_rd_i=top&ref_=chttp_tt_85,"Two strangers find themselves linked in a bizarre way. When a connection forms, will distance be the only thing to keep them apart?Two strangers find themselves linked in a bizarre way. When a connection forms, will distance be the only thing to keep them apart?Two strangers find themselves linked in a bizarre way. When a connection forms, will distance be the only thing to keep them apart?"
85,Spider-Man: Sin Camino a Casa,8.269914397889403,593207,(2021),"Jon Watts (dir.), Tom Holland, Zendaya",https://www.imdb.com/title/tt10872600/?pf_rd_m=A2FGELUUNOQJNL&pf_rd_p=1a264172-ae11-42e4-8ef7-7fed1973bb8f&pf_rd_r=MBY5AS7XQMWKBXS6Y8N7&pf_rd_s=center-1&pf_rd_t=15506&pf_rd_i=top&ref_=chttp_tt_86,"With Spider-Man's identity now revealed, Peter asks Doctor Strange for help. When a spell goes wrong, dangerous foes from other worlds start to appear, forcing Peter to discover what it trul... Read allWith Spider-Man's identity now revealed, Peter asks Doctor Strange for help. When a spell goes wrong, dangerous foes from other worlds start to appear, forcing Peter to discover what it truly means to be Spider-Man.With Spider-Man's identity now revealed, Peter asks Doctor Strange for help. When a spell goes wrong, dangerous foes from other worlds start to appear, forcing Peter to discover what it truly means to be Spider-Man."
86,El retorno del Jedi,8.26877447922207,1017768,(1983),"Richard Marquand (dir.), Mark Hamill, Harrison Ford",https://www.imdb.com/title/tt0086190/?pf_rd_m=A2FGELUUNOQJNL&pf_rd_p=1a264172-ae11-42e4-8ef7-7fed1973bb8f&pf_rd_r=MBY5AS7XQMWKBXS6Y8N7&pf_rd_s=center-1&pf_rd_t=15506&pf_rd_i=top&ref_=chttp_tt_87,"After a daring mission to rescue Han Solo from Jabba the Hutt, the Rebels dispatch to Endor to destroy the second Death Star. Meanwhile, Luke struggles to help Darth Vader back from the dark... Read allAfter a daring mission to rescue Han Solo from Jabba the Hutt, the Rebels dispatch to Endor to destroy the second Death Star. Meanwhile, Luke struggles to help Darth Vader back from the dark side without falling into the Emperor's trap.After a daring mission to rescue Han Solo from Jabba the Hutt, the Rebels dispatch to Endor to destroy the second Death Star. Meanwhile, Luke struggles to help Darth Vader back from the dark side without falling into the Emperor's trap."
87,3 Idiots,8.268049513914695,384155,(2009),"Rajkumar Hirani (dir.), Aamir Khan, Madhavan",https://www.imdb.com/title/tt1187043/?pf_rd_m=A2FGELUUNOQJNL&pf_rd_p=1a264172-ae11-42e4-8ef7-7fed1973bb8f&pf_rd_r=MBY5AS7XQMWKBXS6Y8N7&pf_rd_s=center-1&pf_rd_t=15506&pf_rd_i=top&ref_=chttp_tt_88,"Two friends are searching for their long lost companion. They revisit their college days and recall the memories of their friend who inspired them to think differently, even as the rest of t... Read allTwo friends are searching for their long lost companion. They revisit their college days and recall the memories of their friend who inspired them to think differently, even as the rest of the world called them ""idiots"".Two friends are searching for their long lost companion. They revisit their college days and recall the memories of their friend who inspired them to think differently, even as the rest of the world called them ""idiots""."
88,2001: Odisea del espacio,8.266972084810222,649486,(1968),"Stanley Kubrick (dir.), Keir Dullea, Gary Lockwood",https://www.imdb.com/title/tt0062622/?pf_rd_m=A2FGELUUNOQJNL&pf_rd_p=1a264172-ae11-42e4-8ef7-7fed1973bb8f&pf_rd_r=MBY5AS7XQMWKBXS6Y8N7&pf_rd_s=center-1&pf_rd_t=15506&pf_rd_i=top&ref_=chttp_tt_89,"The Monoliths push humanity to reach for the stars; after their discovery in Africa generations ago, the mysterious objects lead mankind on an awesome journey to Jupiter, with the help of H.... Read allThe Monoliths push humanity to reach for the stars; after their discovery in Africa generations ago, the mysterious objects lead mankind on an awesome journey to Jupiter, with the help of H.A.L. 9000: the world's greatest supercomputer.The Monoliths push humanity to reach for the stars; after their discovery in Africa generations ago, the mysterious objects lead mankind on an awesome journey to Jupiter, with the help of H.A.L. 9000: the world's greatest supercomputer."
89,Reservoir Dogs,8.265868762101977,987415,(1992),"Quentin Tarantino (dir.), Harvey Keitel, Tim Roth",https://www.imdb.com/title/tt0105236/?pf_rd_m=A2FGELUUNOQJNL&pf_rd_p=1a264172-ae11-42e4-8ef7-7fed1973bb8f&pf_rd_r=MBY5AS7XQMWKBXS6Y8N7&pf_rd_s=center-1&pf_rd_t=15506&pf_rd_i=top&ref_=chttp_tt_90,"When a simple jewelry heist goes horribly wrong, the surviving criminals begin to suspect that one of them is a police informant.When a simple jewelry heist goes horribly wrong, the surviving criminals begin to suspect that one of them is a police informant.When a simple jewelry heist goes horribly wrong, the surviving criminals begin to suspect that one of them is a police informant."
90,Eternal Sunshine of the Spotless Mind,8.265544197809037,977689,(2004),"Michel Gondry (dir.), Jim Carrey, Kate Winslet",https://www.imdb.com/title/tt0338013/?pf_rd_m=A2FGELUUNOQJNL&pf_rd_p=1a264172-ae11-42e4-8ef7-7fed1973bb8f&pf_rd_r=MBY5AS7XQMWKBXS6Y8N7&pf_rd_s=center-1&pf_rd_t=15506&pf_rd_i=top&ref_=chttp_tt_91,"When their relationship turns sour, a couple undergoes a medical procedure to have each other erased from their memories.When their relationship turns sour, a couple undergoes a medical procedure to have each other erased from their memories.When their relationship turns sour, a couple undergoes a medical procedure to have each other erased from their memories."
91,Tengoku to jigoku,8.261365797801222,42432,(1963),"Akira Kurosawa (dir.), Toshirô Mifune, Yutaka Sada",https://www.imdb.com/title/tt0057565/?pf_rd_m=A2FGELUUNOQJNL&pf_rd_p=1a264172-ae11-42e4-8ef7-7fed1973bb8f&pf_rd_r=MBY5AS7XQMWKBXS6Y8N7&pf_rd_s=center-1&pf_rd_t=15506&pf_rd_i=top&ref_=chttp_tt_92,An executive of a Yokohama shoe company becomes a victim of extortion when his chauffeur's son is kidnapped by mistake and held for ransom.An executive of a Yokohama shoe company becomes a victim of extortion when his chauffeur's son is kidnapped by mistake and held for ransom.An executive of a Yokohama shoe company becomes a victim of extortion when his chauffeur's son is kidnapped by mistake and held for ransom.
92,Citizen Kane,8.259635918918617,433185,(1941),"Orson Welles (dir.), Orson Welles, Joseph Cotten",https://www.imdb.com/title/tt0033467/?pf_rd_m=A2FGELUUNOQJNL&pf_rd_p=1a264172-ae11-42e4-8ef7-7fed1973bb8f&pf_rd_r=MBY5AS7XQMWKBXS6Y8N7&pf_rd_s=center-1&pf_rd_t=15506&pf_rd_i=top&ref_=chttp_tt_93,"Following the death of publishing tycoon Charles Foster Kane, reporters scramble to uncover the meaning of his final utterance: 'Rosebud.'Following the death of publishing tycoon Charles Foster Kane, reporters scramble to uncover the meaning of his final utterance: 'Rosebud.'Following the death of publishing tycoon Charles Foster Kane, reporters scramble to uncover the meaning of his final utterance: 'Rosebud.'"
93,Cafarnaúm-La ciudad olvidada,8.257632108046126,83925,(2018),"Nadine Labaki (dir.), Zain Al Rafeea, Yordanos Shiferaw",https://www.imdb.com/title/tt8267604/?pf_rd_m=A2FGELUUNOQJNL&pf_rd_p=1a264172-ae11-42e4-8ef7-7fed1973bb8f&pf_rd_r=MBY5AS7XQMWKBXS6Y8N7&pf_rd_s=center-1&pf_rd_t=15506&pf_rd_i=top&ref_=chttp_tt_94,"While serving a five-year sentence for a violent crime, a 12-year-old boy sues his parents for neglect.While serving a five-year sentence for a violent crime, a 12-year-old boy sues his parents for neglect.While serving a five-year sentence for a violent crime, a 12-year-old boy sues his parents for neglect."
94,Lawrence of Arabia,8.257149000335792,287160,(1962),"David Lean (dir.), Peter O'Toole, Alec Guinness",https://www.imdb.com/title/tt0056172/?pf_rd_m=A2FGELUUNOQJNL&pf_rd_p=1a264172-ae11-42e4-8ef7-7fed1973bb8f&pf_rd_r=MBY5AS7XQMWKBXS6Y8N7&pf_rd_s=center-1&pf_rd_t=15506&pf_rd_i=top&ref_=chttp_tt_95,"The story of T.E. Lawrence, the English officer who successfully united and led the diverse, often warring, Arab tribes during World War I in order to fight the Turks.The story of T.E. Lawrence, the English officer who successfully united and led the diverse, often warring, Arab tribes during World War I in order to fight the Turks.The story of T.E. Lawrence, the English officer who successfully united and led the diverse, often warring, Arab tribes during World War I in order to fight the Turks."
95,M - Eine Stadt sucht einen Mörder,8.256100695918086,154818,(1931),"Fritz Lang (dir.), Peter Lorre, Ellen Widmann",https://www.imdb.com/title/tt0022100/?pf_rd_m=A2FGELUUNOQJNL&pf_rd_p=1a264172-ae11-42e4-8ef7-7fed1973bb8f&pf_rd_r=MBY5AS7XQMWKBXS6Y8N7&pf_rd_s=center-1&pf_rd_t=15506&pf_rd_i=top&ref_=chttp_tt_96,"When the police in a German city are unable to catch a child-murderer, other criminals join in the manhunt.When the police in a German city are unable to catch a child-murderer, other criminals join in the manhunt.When the police in a German city are unable to catch a child-murderer, other criminals join in the manhunt."
96,North by Northwest,8.254892091565136,320693,(1959),"Alfred Hitchcock (dir.), Cary Grant, Eva Marie Saint",https://www.imdb.com/title/tt0053125/?pf_rd_m=A2FGELUUNOQJNL&pf_rd_p=1a264172-ae11-42e4-8ef7-7fed1973bb8f&pf_rd_r=MBY5AS7XQMWKBXS6Y8N7&pf_rd_s=center-1&pf_rd_t=15506&pf_rd_i=top&ref_=chttp_tt_97,"A New York City advertising executive goes on the run after being mistaken for a government agent by a group of foreign spies, and falls for a woman whose loyalties he begins to doubt.A New York City advertising executive goes on the run after being mistaken for a government agent by a group of foreign spies, and falls for a woman whose loyalties he begins to doubt.A New York City advertising executive goes on the run after being mistaken for a government agent by a group of foreign spies, and falls for a woman whose loyalties he begins to doubt."
97,La cacería,8.254381583912876,318072,(2012),"Thomas Vinterberg (dir.), Mads Mikkelsen, Thomas Bo Larsen",https://www.imdb.com/title/tt2106476/?pf_rd_m=A2FGELUUNOQJNL&pf_rd_p=1a264172-ae11-42e4-8ef7-7fed1973bb8f&pf_rd_r=MBY5AS7XQMWKBXS6Y8N7&pf_rd_s=center-1&pf_rd_t=15506&pf_rd_i=top&ref_=chttp_tt_98,"A teacher lives a lonely life, all the while struggling over his son's custody. His life slowly gets better as he finds love and receives good news from his son, but his new luck is about to... Read allA teacher lives a lonely life, all the while struggling over his son's custody. His life slowly gets better as he finds love and receives good news from his son, but his new luck is about to be brutally shattered by an innocent little lie.A teacher lives a lonely life, all the while struggling over his son's custody. His life slowly gets better as he finds love and receives good news from his son, but his new luck is about to be brutally shattered by an innocent little lie."
98,Vertigo,8.24876806827767,393345,(1958),"Alfred Hitchcock (dir.), James Stewart, Kim Novak",https://www.imdb.com/title/tt0052357/?pf_rd_m=A2FGELUUNOQJNL&pf_rd_p=1a264172-ae11-42e4-8ef7-7fed1973bb8f&pf_rd_r=MBY5AS7XQMWKBXS6Y8N7&pf_rd_s=center-1&pf_rd_t=15506&pf_rd_i=top&ref_=chttp_tt_99,"A former San Francisco police detective juggles wrestling with his personal demons and becoming obsessed with the hauntingly beautiful woman he has been hired to trail, who may be deeply dis... Read allA former San Francisco police detective juggles wrestling with his personal demons and becoming obsessed with the hauntingly beautiful woman he has been hired to trail, who may be deeply disturbed.A former San Francisco police detective juggles wrestling with his personal demons and becoming obsessed with the hauntingly beautiful woman he has been hired to trail, who may be deeply disturbed."
99,Le fabuleux destin d'Amélie Poulain,8.247902217205672,741504,(2001),"Jean-Pierre Jeunet (dir.), Audrey Tautou, Mathieu Kassovitz",https://www.imdb.com/title/tt0211915/?pf_rd_m=A2FGELUUNOQJNL&pf_rd_p=1a264172-ae11-42e4-8ef7-7fed1973bb8f&pf_rd_r=MBY5AS7XQMWKBXS6Y8N7&pf_rd_s=center-1&pf_rd_t=15506&pf_rd_i=top&ref_=chttp_tt_100,"Amélie is an innocent and naive girl in Paris with her own sense of justice. She decides to help those around her and, along the way, discovers love.Amélie is an innocent and naive girl in Paris with her own sense of justice. She decides to help those around her and, along the way, discovers love.Amélie is an innocent and naive girl in Paris with her own sense of justice. She decides to help those around her and, along the way, discovers love."
